id,conversation_id,created_at,date,time,timezone,user_id,username,name,place,tweet,language,mentions,urls,photos,replies_count,retweets_count,likes_count,hashtags,cashtags,link,retweet,quote_url,video,thumbnail,near,geo,source,user_rt_id,user_rt,retweet_id,reply_to,retweet_date,translate,trans_src,trans_dest
1389006698388488197,1389000267924865027,2021-05-03 05:29:38 India Standard Time,2021-05-03,05:29:38,+0530,774905912599334912,abhaysinghind,Abhay Chauhan,,"An urgent request for rural Uttar Pradesh. A time bomb of suspected Covid cases is exploding across UP. Village after village. First the Kumbh returnees, then the Panchayat elections, now the weddings. No tests, no treatment, negligible vaccination. PLEASE act fast.@neeleshmisra  https://t.co/yqaloJ32W8",en,"[{'screen_name': 'neeleshmisra', 'name': 'neelesh misra', 'id': '31119205'}]",[],"['https://pbs.twimg.com/media/E0a-MLUVgAMuphF.jpg', 'https://pbs.twimg.com/media/E0a-M4BVIAEy2O9.jpg', 'https://pbs.twimg.com/media/E0a-NbqUcAE5V5l.jpg', 'https://pbs.twimg.com/media/E0a-ONoVgAIYF5i.jpg']",0,0,0,[],[],https://twitter.com/abhaysinghIND/status/1389006698388488197,False,,1,https://pbs.twimg.com/media/E0a-MLUVgAMuphF.jpg,India,,,,,,[],,,,
1389006372017111042,1389006372017111042,2021-05-03 05:28:20 India Standard Time,2021-05-03,05:28:20,+0530,1228991689,nanahanna94,Aidah Farhana,,"Officemate positif covid, also company “esok keje mcm biasa” “dah sanitise” 💁🏻‍♀️",in,[],[],[],0,0,0,[],[],https://twitter.com/nanahanna94/status/1389006372017111042,False,,0,,India,,,,,,[],,,,
1389005117265874947,1389005117265874947,2021-05-03 05:23:21 India Standard Time,2021-05-03,05:23:21,+0530,780444901750153217,swati1206,Dr Swati Gupta,,@shalbyhospitals @MoHFW_INDIA @ICMRDELHI  hospital’s mismanagement costed me with covid-19 3h to get vaccinated Giving covid-19 infection for free to those coming for vaccination  My suggestion - pls dnt visit this place for any medical aid,en,"[{'screen_name': 'mohfw_india', 'name': 'ministry of health', 'id': '2596143056'}, {'screen_name': 'icmrdelhi', 'name': 'icmr', 'id': '2695241174'}]",[],[],1,0,0,[],[],https://twitter.com/swati1206/status/1389005117265874947,False,,0,,India,,,,,,[],,,,
1389005068226031618,1389005068226031618,2021-05-03 05:23:09 India Standard Time,2021-05-03,05:23:09,+0530,1370453774343438340,kritisforum,Forum Masyarakat Kritis,,Di daerah banyak dugaan penyalah gunaan dana Covid 19. Herannya bisa lolos audit. Kita bisa percaya siapa sekarang ?,in,[],[],[],0,0,0,[],[],https://twitter.com/KritisForum/status/1389005068226031618,False,,0,,India,,,,,,[],,,,
1389004793151049728,1389004793151049728,2021-05-03 05:22:03 India Standard Time,2021-05-03,05:22:03,+0530,717488096,mishra_3,"Dr Navin Kumar Mishra, MD,MPH,FAPSR.",,Covid 19 Pandemic Second Wave  https://t.co/NmS6a88eub,en,[],['https://youtu.be/oNSgExo4b7g'],[],0,0,0,[],[],https://twitter.com/mishra_3/status/1389004793151049728,False,,0,,India,,,,,,[],,,,
1389003344237060096,1389003344237060096,2021-05-03 05:16:18 India Standard Time,2021-05-03,05:16:18,+0530,1246847330566864896,praveen_umesh,Praveen Umesh Savant,,@highcourtdelhi why court not taking all contol of Delhi ?Why court waiting for govt n authority to answers?court can save life ! all blame games going on by state n central during Covid crises daily death rates r going high with poor control  n management ! @PTI_News #delhi,en,"[{'screen_name': 'pti_news', 'name': 'press trust of india', 'id': '245687754'}]",[],[],1,3,4,['delhi'],[],https://twitter.com/praveen_umesh/status/1389003344237060096,False,,0,,India,,,,,,[],,,,
1389003230512750598,1389003230512750598,2021-05-03 05:15:51 India Standard Time,2021-05-03,05:15:51,+0530,389891352,seemas_khan,SeemaKhan,,Early morning  prayers for all  🙏🤲 Pls Allah save us from this Covid Pandemic. Heal each and everyone from this deadly disease. Keep everyone safe and healthy. Not a single person should die due to lack of medicines. Nor a single person should sleep hungry.,en,[],[],[],0,1,18,[],[],https://twitter.com/Seemas_Khan/status/1389003230512750598,False,,0,,India,,,,,,[],,,,
1389002395301163021,1389002395301163021,2021-05-03 05:12:32 India Standard Time,2021-05-03,05:12:32,+0530,710553003569205250,realirrfan,irfan | عرفان,,"India hits new grim record with 3,689 COVID-19 deaths in one day. #KindAttnPMNarendraMod #COVID19 #CovidIndia #COVID19Vaccine #didi_o_didi  https://t.co/MrF8jcLKTs",en,[],[],[],0,2,14,"['kindattnpmnarendramod', 'covid19', 'covidindia', 'covid19vaccine', 'didi_o_didi']",[],https://twitter.com/Realirrfan/status/1389002395301163021,False,,1,https://pbs.twimg.com/ext_tw_video_thumb/1389002004287066113/pu/img/2YAJBHee6NW2beTc.jpg,India,,,,,,[],,,,
1389000754095030278,1389000754095030278,2021-05-03 05:06:00 India Standard Time,2021-05-03,05:06:00,+0530,1046351472,abyramli29,adawiah ramli,,"Masa kkm x share the real situation in icu, ramai dok kata kkm tipu data lah apa lah,covid ni acah je la yada yada, bila dah share gmbr and situasi, dok ckp consent bagai la apa la. Rakyat malaysia ni mmg jenis semua tak kena eh? Kau je yg betul? Org lain salah? Mcm tuuu",in,[],[],[],1,0,0,[],[],https://twitter.com/abyramli29/status/1389000754095030278,False,,0,,India,,,,,,[],,,,
1389000284588830720,1389000284588830720,2021-05-03 05:04:08 India Standard Time,2021-05-03,05:04:08,+0530,203805092,amvalano,Ana Maria Alano,,Wag makulit. Wait lang! Get vaccinated  pa din when offerred. #ivermectin #covid,en,[],[],[],0,0,0,"['ivermectin', 'covid']",[],https://twitter.com/amvalano/status/1389000284588830720,False,https://twitter.com/pcp1953/status/1388806246011076609,0,,India,,,,,,[],,,,
1388999652075204610,1388999652075204610,2021-05-03 05:01:38 India Standard Time,2021-05-03,05:01:38,+0530,233520610,rngraj,RAJIV DATTA,,"@himantabiswa @narendramodi @sambitswaraj @smritiirani @AmitShah  Already we are in difficult Covid situation , these kind on news really does not inspire anyone .....  https://t.co/imEJNaOFmv",en,"[{'screen_name': 'narendramodi', 'name': 'narendra modi', 'id': '18839785'}, {'screen_name': 'sambitswaraj', 'name': 'sambit patra', 'id': '1368737382'}, {'screen_name': 'smritiirani', 'name': 'smriti z irani', 'id': '130104041'}, {'screen_name': 'amitshah', 'name': 'amit shah', 'id': '1447949844'}]",[],['https://pbs.twimg.com/media/E0a3wZiVgAIkUoY.jpg'],0,0,0,[],[],https://twitter.com/rngraj/status/1388999652075204610,False,,1,https://pbs.twimg.com/media/E0a3wZiVgAIkUoY.jpg,India,,,,,,[],,,,
1388999454657859584,1388965574076665861,2021-05-03 05:00:51 India Standard Time,2021-05-03,05:00:51,+0530,1223530579213398016,salim33364321,Salim Parkar,,@arabnews Residents who have completed 2 doses of covid vaccine shall be allowed to come to Saudi Arabia with 7 days home quorontine.,en,[],[],[],0,0,0,[],[],https://twitter.com/salim33364321/status/1388999454657859584,False,,0,,India,,,,,,"[{'screen_name': 'arabnews', 'name': 'Arab News', 'id': '69172612'}]",,,,
1388999178622173185,1388999178622173185,2021-05-03 04:59:45 India Standard Time,2021-05-03,04:59:45,+0530,389891352,seemas_khan,SeemaKhan,,Update : Ration kits  to support single mothers who are running their houses and their children all by themselves struggling to survive in this Covid situation.  Pls RT and spread the word to *Donate Now to help Single mothers*   https://t.co/sqFaIR8hhL  https://t.co/KlEx5vrlk3,en,[],['https://www.ketto.org/fundraiser/medicines-and-food-relief?utm_medium=whatsappShare&utm_content=1823984&shby=1&utm_source=internal&utm_campaign=medicines-and-food-relief'],"['https://pbs.twimg.com/media/E0a3YR5VkAASYFd.jpg', 'https://pbs.twimg.com/media/E0a3YrOVkAE7MhX.jpg', 'https://pbs.twimg.com/media/E0a3Y_9UcAExQg2.jpg']",1,7,17,[],[],https://twitter.com/Seemas_Khan/status/1388999178622173185,False,,1,https://pbs.twimg.com/media/E0a3YR5VkAASYFd.jpg,India,,,,,,[],,,,
1388997792392044544,1388997792392044544,2021-05-03 04:54:14 India Standard Time,2021-05-03,04:54:14,+0530,1283045650800750595,jdpramod1,々Pramod々Sirohiya々,,"इस ख़तरनाक situation में भी जिन लोगों को ये लग रहा है , कि करोना जैसा कुछ नही है !! वो लोग एक बार RUHS covid हॉस्पिटल आकर उन लोगों के चहरे देख लें जिनके relative यहाँ पर भर्ती हैं अगर आप इंसान हैं, तों आपको एक एसा डरा हुआ चहरा दिखायी देगा जो आपकी रूह कंपा सकता है !!",hi,[],[],[],0,0,5,[],[],https://twitter.com/JDPramod1/status/1388997792392044544,False,,0,,India,,,,,,[],,,,
1388997102185979906,1388997102185979906,2021-05-03 04:51:30 India Standard Time,2021-05-03,04:51:30,+0530,1080588342016835584,the_dilawar09,Dilawar,,#COVIDEmergency2021 #COVID19 #Covid_19 #COVID19Vaccine #LineOfDuty #Pakistan,und,[],[],[],0,1,1,"['covidemergency2021', 'covid19', 'covid_19', 'covid19vaccine', 'lineofduty', 'pakistan']",[],https://twitter.com/the_dilawar09/status/1388997102185979906,False,https://twitter.com/OfficialNcoc/status/1388989885621604354,0,,India,,,,,,[],,,,
1388996488714276864,1388996488714276864,2021-05-03 04:49:03 India Standard Time,2021-05-03,04:49:03,+0530,450505549,bhaskarkanungo,Bhaskar Kanungo,,"@ndtv Only positive news of Covid-19 is it did a justice to a criminal. Indian judiciary did not gave him death sentence for his crimes, some how Covid-19 had to step in. I wish Covid-19 to intervene in same manner with criminal politicians of India   https://t.co/NBFZ7NvyJ9",en,[],['https://www.ndtv.com/india-news/jailed-ex-rjd-mp-mohammad-shahabuddin-dies-of-covid-at-delhi-hospital-2425861'],[],0,0,0,[],[],https://twitter.com/bhaskarkanungo/status/1388996488714276864,False,,0,,India,,,,,,[],,,,
1388996295939956740,1388956551541518338,2021-05-03 04:48:17 India Standard Time,2021-05-03,04:48:17,+0530,452845361,fahimkhanhr,Fahim Khan,,@ANI Hello @mkstalin @vijayanpinarayi @MamataOfficial I humbly request you to not make your swearing ceremony a grand event due to COVID. An online thing would be much appreciated.,en,"[{'screen_name': 'mkstalin', 'name': 'm.k.stalin', 'id': '2163039523'}, {'screen_name': 'vijayanpinarayi', 'name': 'pinarayi vijayan', 'id': '2707179805'}, {'screen_name': 'mamataofficial', 'name': 'mamata banerjee', 'id': '2526794479'}]",[],[],0,0,0,[],[],https://twitter.com/fahimkhanhr/status/1388996295939956740,False,,0,,India,,,,,,"[{'screen_name': 'ANI', 'name': 'ANI', 'id': '355989081'}]",,,,
1388995697525985280,1388995697525985280,2021-05-03 04:45:55 India Standard Time,2021-05-03,04:45:55,+0530,618208330,faizahkamal97,Melor| Wawawax.byfaizah,,Haihh la China yg mula covid die yg settle covid . Huhhhh,in,[],[],[],0,0,0,[],[],https://twitter.com/FaizahKamal97/status/1388995697525985280,False,,0,,India,,,,,,[],,,,
1388995476570079234,1388995476570079234,2021-05-03 04:45:02 India Standard Time,2021-05-03,04:45:02,+0530,1348994525444730882,shaharbeen,SHAHARBEEN NEWS SERVICE KASHMIR (SNS),,No ICU facility available at Associated Hospital GMC Baramulla as 13 ventilators are eating dust and dirt in stores. All 60 beds for Covid-19 patients are occupied so where will other Covid-19 patients go  @OfficeOfLGJandK  @DCBaramulla  @kansalrohit69  https://t.co/p79cnYCFvy,en,"[{'screen_name': 'officeoflgjandk', 'name': 'office of lg j&k', 'id': '1311622751216562176'}, {'screen_name': 'dcbaramulla', 'name': 'deputy commissioner baramulla', 'id': '1367061212689616897'}, {'screen_name': 'kansalrohit69', 'name': 'rohit kansal', 'id': '731117568556142592'}]",[],['https://pbs.twimg.com/media/E0a0Be7VcAA4q_n.jpg'],1,0,5,[],[],https://twitter.com/shaharbeen/status/1388995476570079234,False,,1,https://pbs.twimg.com/media/E0a0Be7VcAA4q_n.jpg,India,,,,,,[],,,,
1388995094489956360,1388989643417214979,2021-05-03 04:43:31 India Standard Time,2021-05-03,04:43:31,+0530,146388938,mohammedift,mohd. iftekhar shaik,,@hussain2577 @sameerdys @zeeshan_iyc @msisodia Talk to any Gurdwara Prabandhak they have started a new covid centre in Delhi with oxygen beds,en,[],[],[],0,0,0,[],[],https://twitter.com/MohammedIft/status/1388995094489956360,False,,0,,India,,,,,,"[{'screen_name': 'hussain2577', 'name': 'Hussain Taseer', 'id': '280396564'}, {'screen_name': 'sameerdys', 'name': 'Nadeem', 'id': '977275949178798081'}, {'screen_name': 'zeeshan_iyc', 'name': 'Zeeshan Siddique', 'id': '560762145'}, {'screen_name': 'msisodia', 'name': 'Manish Sisodia', 'id': '30417501'}]",,,,
1389731426543673353,1389504333528641539,2021-05-05 05:29:26 India Standard Time,2021-05-05,05:29:26,+0530,2421731642,itsmesmsai,Roy_codm,,"@Ferg Just a shoutout As the covid 2nd wave has hit India hard, Parker is doing a charity stream this Thursday, where all the donations and everything will be given to the Charities in India helping with Covid, Make sure to join.",en,[],[],[],0,0,0,[],[],https://twitter.com/itsmesmsai/status/1389731426543673353,False,,0,,India,,,,,,"[{'screen_name': 'Ferg', 'name': 'Ferg', 'id': '807726368444284928'}]",,,,
1389731083005022212,1389557018181083136,2021-05-05 05:28:04 India Standard Time,2021-05-05,05:28:04,+0530,1337997902422056960,vramankumar,vare ramankumar,,@moefcc @PrakashJavdekar @SuPriyoBabul @PIB_India @PIBHindi I totally agree with you Sir about samples.of Asiatic  https://t.co/xLtiB2IZHp Hyderabad Zoo  found Covid Positive reveals infection.infection.not  https://t.co/XEjciMZckq any variant of Concern.and thete is no factual evidence  that animals can transmit the disease to Human's.,en,[],"['http://Lions.in', 'http://caused.by']",[],0,0,0,[],[],https://twitter.com/VRamankumar/status/1389731083005022212,False,,0,,India,,,,,,"[{'screen_name': 'moefcc', 'name': 'MoEF&CC', 'id': '2615251201'}, {'screen_name': 'PrakashJavdekar', 'name': 'Prakash Javadekar', 'id': '1072993274'}, {'screen_name': 'SuPriyoBabul', 'name': 'Babul Supriyo', 'id': '120293182'}, {'screen_name': 'PIB_India', 'name': 'PIB India', 'id': '231033118'}, {'screen_name': 'PIBHindi', 'name': 'पीआईबी हिंदी', 'id': '3000838099'}]",,,,
1389731037601697793,1389608055462010880,2021-05-05 05:27:53 India Standard Time,2021-05-05,05:27:53,+0530,2421731642,itsmesmsai,Roy_codm,,"@CODM_murdablast Just a shoutout As the covid 2nd wave has hit India hard, Parker is doing a charity stream this Thursday, where all the donations and everything will be given to the Charities in India helping with Covid, Make sure to join.",en,[],[],[],0,0,1,[],[],https://twitter.com/itsmesmsai/status/1389731037601697793,False,,0,,India,,,,,,"[{'screen_name': 'CODM_murdablast', 'name': 'CODM - 2022 | NEWS,LEAKS AND UPDATES', 'id': '1056378784666931200'}]",,,,
1389730739873140744,1389659849860993029,2021-05-05 05:26:42 India Standard Time,2021-05-05,05:26:42,+0530,2421731642,itsmesmsai,Roy_codm,,"@CoDMobileClips Just a shoutout As the covid 2nd wave has hit India hard, Parker is doing a charity stream this Thursday, where all the donations and everything will be given to the Charities in India helping with Covid, Make sure to join.",en,[],[],[],1,0,2,[],[],https://twitter.com/itsmesmsai/status/1389730739873140744,False,,0,,India,,,,,,[],,,,
1389729334894632961,1389691458362306562,2021-05-05 05:21:08 India Standard Time,2021-05-05,05:21:08,+0530,2421731642,itsmesmsai,Roy_codm,,"@JHCGaming @PlayCODMobile Just a shoutout As the covid 2nd wave has hit India hard, Parker is doing a charity stream this Thursday, where all the donations and everything will be given to the Charities in India helping with Covid, Make sure to join.",en,[],[],[],0,0,0,[],[],https://twitter.com/itsmesmsai/status/1389729334894632961,False,,0,,India,,,,,,"[{'screen_name': 'JHCGaming', 'name': 'JHC Gaming', 'id': '3941607435'}, {'screen_name': 'PlayCODMobile', 'name': 'Call of Duty: Mobile', 'id': '1166443278834659328'}]",,,,
1389729292062531584,1389691458362306562,2021-05-05 05:20:57 India Standard Time,2021-05-05,05:20:57,+0530,2421731642,itsmesmsai,Roy_codm,,"@Ferg @PlayCODMobile Just a shoutout As the covid 2nd wave has hit India hard, Parker is doing a charity stream this Thursday, where all the donations and everything will be given to the Charities in India helping with Covid, Make sure to join.",en,[],[],[],0,0,10,[],[],https://twitter.com/itsmesmsai/status/1389729292062531584,False,,0,,India,,,,,,"[{'screen_name': 'Ferg', 'name': 'Ferg', 'id': '807726368444284928'}, {'screen_name': 'PlayCODMobile', 'name': 'Call of Duty: Mobile', 'id': '1166443278834659328'}]",,,,
1389729236911419394,1389691458362306562,2021-05-05 05:20:44 India Standard Time,2021-05-05,05:20:44,+0530,2421731642,itsmesmsai,Roy_codm,,"@PlayCODMobile Just a shoutout As the covid 2nd wave has hit India hard, Parker is doing a charity stream this Thursday, where all the donations and everything will be given to the Charities in India helping with Covid, Make sure to join.",en,[],[],[],0,0,0,[],[],https://twitter.com/itsmesmsai/status/1389729236911419394,False,,0,,India,,,,,,"[{'screen_name': 'PlayCODMobile', 'name': 'Call of Duty: Mobile', 'id': '1166443278834659328'}]",,,,
1389728868563488770,1389726921358036995,2021-05-05 05:19:16 India Standard Time,2021-05-05,05:19:16,+0530,2421731642,itsmesmsai,Roy_codm,,"@GEMINI_Ios @yanriquewright @KvleofficialYT @Nevvado1 @TrzanGaming Just a shoutout As the covid 2nd wave has hit India hard, Parker is doing a charity stream this Thursday, where all the donations and everything will be given to the Charities in India helping with Covid, Make sure to join.",en,[],[],[],1,0,2,[],[],https://twitter.com/itsmesmsai/status/1389728868563488770,False,,0,,India,,,,,,"[{'screen_name': 'GEMINI_Ios', 'name': 'GEMINI 🇯🇲', 'id': '3377804873'}, {'screen_name': 'yanriquewright', 'name': 'TRB Yanrique', 'id': '521814671'}, {'screen_name': 'KvleofficialYT', 'name': 'TRB Kvle', 'id': '1241286006462087168'}, {'screen_name': 'Nevvado1', 'name': 'Nevvado S', 'id': '3115995042'}, {'screen_name': 'TrzanGaming', 'name': 'Trzanofficial', 'id': '1256188600259162115'}]",,,,
1389728404799332352,1389728404799332352,2021-05-05 05:17:26 India Standard Time,2021-05-05,05:17:26,+0530,1387732567940419584,ashishj38380310,Er. Ashish Jain,,"Urgently required a ventilator  Please help  Patient's Name- shobha rani Age- 63 CT Score- 18 SpO2- 82 Admitted in Ward- Covid,  CK Birla  7742034049 (Amit Jain)  7737836635 (Lucky)  @DrSatishPoonia #BJYMCaresrajasthan @jethanandani14 @RamcharanBohra @HimanshuSBJYM  https://t.co/zc8H8qNcvN",en,"[{'screen_name': 'drsatishpoonia', 'name': 'satish poonia', 'id': '2266188361'}, {'screen_name': 'jethanandani14', 'name': 'jitesh jethanandani', 'id': '498571300'}, {'screen_name': 'ramcharanbohra', 'name': 'ramcharan bohra', 'id': '1568127072'}, {'screen_name': 'himanshusbjym', 'name': 'himanshu sharma', 'id': '2292675078'}]",[],['https://pbs.twimg.com/media/E0lOnjlXsAUT_gY.jpg'],0,0,2,['bjymcaresrajasthan'],[],https://twitter.com/AshishJ38380310/status/1389728404799332352,False,,1,https://pbs.twimg.com/media/E0lOnjlXsAUT_gY.jpg,India,,,,,,[],,,,
1389728249526185984,1389728249526185984,2021-05-05 05:16:49 India Standard Time,2021-05-05,05:16:49,+0530,436660392,salilcaravan,Salil Sudhakar,,"Yesterday my mom with her mom and dad in their 80's took their 2nd dose of Covishield, this gave me some sort of relief. Best thing is that their samples were taken for COVID test before being vaccinated. @DumkaDc thanks for making it easier the report will give some more relief.",en,"[{'screen_name': 'dumkadc', 'name': 'dc_dumka', 'id': '1146681658055094273'}]",[],[],0,0,1,[],[],https://twitter.com/salilcaravan/status/1389728249526185984,False,,0,,India,,,,,,[],,,,
1389727894377680896,1388416798282952707,2021-05-05 05:15:24 India Standard Time,2021-05-05,05:15:24,+0530,891653277334597633,saifurrehman841,Saif Ur Rehman,,@PakPMO @PTIofficial @ImranKhanPTI As a PTI Worker I have few Questions in My Mind! How can We Form Riyasat-e-Madina by having dual behaviour towards its People ? Covid-19 SOP's are Different for Different People's ? Bribe is Still in Our Country ? No Check and Balance ? What We Reply to people who ask from Us?,en,[],[],[],0,0,0,[],[],https://twitter.com/SaifUrRehman841/status/1389727894377680896,False,,0,,India,,,,,,"[{'screen_name': 'PakPMO', 'name': ""Prime Minister's Office, Pakistan"", 'id': '1040146057093627904'}, {'screen_name': 'PTIofficial', 'name': 'PTI', 'id': '127483019'}, {'screen_name': 'ImranKhanPTI', 'name': 'Imran Khan', 'id': '122453931'}]",,,,
1389726976760434688,1389726976760434688,2021-05-05 05:11:45 India Standard Time,2021-05-05,05:11:45,+0530,721965701771173888,humaspoldaaceh,Bidhumas Polda Aceh,,"Buka RakorLintas Sektoral, Kapolda Aceh : Kita Harus Belajar Dari Lonjakan Covid-19 di India, bertempat di Aula Machdum Sakti Polda Aceh, Selasa (4/5/21).  @DivHumas_Polri  @Polripresisi   #bidhumaspoldaaceh #polripresisi #poldaaceh  https://t.co/XnI5Jpf75K",in,"[{'screen_name': 'divhumas_polri', 'name': 'divisi humas polri', 'id': '138290629'}, {'screen_name': 'polripresisi', 'name': 'polri presisi', 'id': '742830794'}]",[],"['https://pbs.twimg.com/media/E0lNTMHVcAAZ1IU.jpg', 'https://pbs.twimg.com/media/E0lNTuMVIAEMYSI.jpg', 'https://pbs.twimg.com/media/E0lNUXwUUAg1v34.jpg']",0,0,0,"['bidhumaspoldaaceh', 'polripresisi', 'poldaaceh']",[],https://twitter.com/HumasPoldaAceh/status/1389726976760434688,False,,1,https://pbs.twimg.com/media/E0lNTMHVcAAZ1IU.jpg,India,,,,,,[],,,,
1389726117783760896,1389726117783760896,2021-05-05 05:08:20 India Standard Time,2021-05-05,05:08:20,+0530,135446102,reejusri,Reeju Srivastava,,Culprit BBMP  officials should b send to COVID wards without PPE kit for cleaning activities as a punishment... #COVIDEmergency2021 #BBMP #banglorecovid #zeenews #TimesofIndia #FightAgainstCOVID19  https://t.co/AWCgE7EnIb,en,[],['https://timesofindia.indiatimes.com/city/bengaluru/bribe-for-bed-claims-bruhat-bengaluru-mahanagara-palike-orders-probe/articleshow/82380114.cms'],[],0,0,0,"['covidemergency2021', 'bbmp', 'banglorecovid', 'zeenews', 'timesofindia', 'fightagainstcovid19']",[],https://twitter.com/reejusri/status/1389726117783760896,False,,0,,India,,,,,,[],,,,
1389726104743649283,894439465564880897,2021-05-05 05:08:17 India Standard Time,2021-05-05,05:08:17,+0530,1337362149669101569,aryan75569168,MAJOR SAM...,,"@hussain_imtiyaz Asalam Alikum Sir, here at several places(ANG)people complaint of covid patients are moving outside without any hesitation and nobody is taking care of these things. Esp'lly at far off village's like Sallar Wallarhama etc, Sir u majesty must inform police or concerned tehsildar..",en,[],[],[],0,0,0,[],[],https://twitter.com/ARYAN75569168/status/1389726104743649283,False,,0,,India,,,,,,"[{'screen_name': 'hussain_imtiyaz', 'name': 'Imtiyaz Hussain', 'id': '100945273'}]",,,,
1389725550697189380,1389725550697189380,2021-05-05 05:06:05 India Standard Time,2021-05-05,05:06:05,+0530,1347237505377169408,javedtareen_1,Javed Tareen,,Why this hypocrisy of govt forcing public to follow SOP's by avoiding gatherings and on the other hand govt itself facilitates the spread of virus by such notifications for providing security to a gathering which should have not been allowed for causing the spread of Covid?  https://t.co/mSe1QbuHdw,en,[],[],"['https://pbs.twimg.com/media/E0lMANhXsAETBf0.jpg', 'https://pbs.twimg.com/media/E0lMA6-XoAE2XvN.jpg']",1,3,6,[],[],https://twitter.com/JavedTareen_1/status/1389725550697189380,False,,1,https://pbs.twimg.com/media/E0lMANhXsAETBf0.jpg,India,,,,,,[],,,,
1389724802622033921,1389724802622033921,2021-05-05 05:03:07 India Standard Time,2021-05-05,05:03:07,+0530,724714449697910785,janmuha43901592,Jan akakhail,,Please Listen this video all world 🌎 Muslim only this video Treatment to COvid 19 spesheli And more desiesses treatments please Follow this words please 🤲🤲🤲🙏🙏🙏🌎🇵🇰  https://t.co/ZyjGC13V0m,en,[],[],[],0,0,0,[],[],https://twitter.com/JanMuha43901592/status/1389724802622033921,False,,1,https://pbs.twimg.com/ext_tw_video_thumb/1389724744241516547/pu/img/i2erKQRbFV_EFKp0.jpg,India,,,,,,[],,,,
1389724404880347140,1389436849169469440,2021-05-05 05:01:32 India Standard Time,2021-05-05,05:01:32,+0530,701316127,neilzboi,Neilz,,@mdzulkar9 See a doctor for the sore throat and get a covid test.,en,[],[],[],0,0,0,[],[],https://twitter.com/Neilzboi/status/1389724404880347140,False,,0,,India,,,,,,"[{'screen_name': 'mdzulkar9', 'name': 'unofficial sg gout spokesman', 'id': '22146854'}]",,,,
1389724108854763522,1389724108854763522,2021-05-05 05:00:22 India Standard Time,2021-05-05,05:00:22,+0530,3249147300,yawaralimya,mohammed yawar ali,,As @KTRTRS was tested positive with COVID 19 we would like to no his health condition Hope he is fine but we request @KTRoffice @KTR_News @RaoKavitha to provide the detail about his health condition.,en,"[{'screen_name': 'ktrtrs', 'name': 'ktr', 'id': '118787224'}, {'screen_name': 'ktroffice', 'name': 'office of ktr', 'id': '857093639624945672'}, {'screen_name': 'ktr_news', 'name': 'ktr news', 'id': '870891662054088704'}, {'screen_name': 'raokavitha', 'name': 'kavitha kalvakuntla', 'id': '177673457'}]",[],[],0,0,0,[],[],https://twitter.com/yawaralimya/status/1389724108854763522,False,,0,,India,,,,,,[],,,,
