tweet,clean_tweet,hastags,attherate,urls,emojis
"Germany's Covid response ""was the envy of the world"" - your daily reminder that the world just means ""white people"".  https://t.co/dxbkOVjBCZ  via @GoogleNews",Germanys Covid response was the envy of the world  your daily reminder that the world just means white people  via ,[],['@GoogleNews'],['https://t.co/dxbkOVjBCZ'],[]
"Pfizer &amp; Moderna claim their vaccines very safe &amp; effective Estimated &gt; 1000 deaths asso w Pfizer vaccines in Nor Spain German etc Pfizer is exempted from legal suits by politicians 🙄🤔Collusion❓ Chance of dying from Covid is 5 in 10,000 ⏩3 by vaccine❓  https://t.co/OR1QmkkBS3",Pfizer amp Moderna claim their vaccines very safe amp effective Estimated gt 1000 deaths asso w Pfizer vaccines in Nor Spain German etc Pfizer is exempted from legal suits by politicians Collusion Chance of dying from Covid is 5 in 10000 3 by vaccine ,[],[],['https://t.co/OR1QmkkBS3'],"['🙄', '🤔', '❓', '⏩', '❓']"
We recently published the predictors of hospitalization among older adults with COVID-19  https://t.co/GghAqZSs9t #COVID19 #CoronaVirusUpdates #geriatrics,We recently published the predictors of hospitalization among older adults with COVID19  ,"['#COVID19', '#CoronaVirusUpdates', '#geriatrics']",[],['https://t.co/GghAqZSs9t'],[]
@Alhamdhulillaah Them dey do Covid test 150AED private clinics.  But govt own na free. None will stop me., Them dey do Covid test 150AED private clinics But govt own na free None will stop me,[],['@Alhamdhulillaah'],[],[]
"@YMasannat @VGDakessian Time will tell! So far, and based on the data from millions of people vaccinated around the world, the potential benefits from vaccination against COVID-19 far outweigh the potential side-effects  https://t.co/S8oth5jEEW  https://t.co/1Gjrx3lSYO", Time will tell So far and based on the data from millions of people vaccinated around the world the potential benefits from vaccination against COVID19 far outweigh the potential sideeffects  ,[],"['@YMasannat', '@VGDakessian']","['https://t.co/S8oth5jEEW', 'https://t.co/1Gjrx3lSYO']",[]
Texas and Mississippi lifts ALL its COVID-19 precautions  https://t.co/ni5ZAhDq0A via @MailOnline,Texas and Mississippi lifts ALL its COVID19 precautions  via ,[],['@MailOnline'],['https://t.co/ni5ZAhDq0A'],[]
CDC Says It's Not Time to Ease Up on Covid Restrictions  https://t.co/sOB844tOFi,CDC Says Its Not Time to Ease Up on Covid Restrictions ,[],[],['https://t.co/sOB844tOFi'],[]
“The lymph nodes in your armpit area that we see on your mammogram are larger on the side where you had your recent Covid-19 vaccine”... @YMasannat @VGDakessian,“The lymph nodes in your armpit area that we see on your mammogram are larger on the side where you had your recent Covid19 vaccine” ,[],"['@YMasannat', '@VGDakessian']",[],[]
Preparing New kinds of Knowledge to be Highlighted in Post-Covid-19 Transitioning to serve people and government around the world as a basic necessary perceptions have to be built before. For easier for running all policies moving forward to SDGs as fast as possible👉,Preparing New kinds of Knowledge to be Highlighted in PostCovid19 Transitioning to serve people and government around the world as a basic necessary perceptions have to be built before For easier for running all policies moving forward to SDGs as fast as possible,[],[],[],['👉']
@Asad_Umar till date  no update on Ami ‘s Covid vaccine ! The auto response is only stating we will let you know !!! It’s been over 2 weeks ! @fslsltn #COVID19Vaccination all talk no execution !!, till date no update on Ami ‘s Covid vaccine  The auto response is only stating we will let you know  It’s been over 2 weeks  all talk no execution ,['#COVID19Vaccination'],"['@Asad_Umar', '@fslsltn']",[],[]
Philippines is waiting for the next batch of #donated Covid vaccines 💉 #gustokongmaluha 😭,Philippines is waiting for the next batch of Covid vaccines  ,"['#donated', '#gustokongmaluha']",[],[],"['💉', '😭']"
After a very long couple of weeks our grandmother is now home from Hulhumale’ Covid Facility.  Thank you to everyone who helped to take care of her &amp; my mother there.,After a very long couple of weeks our grandmother is now home from Hulhumale’ Covid Facility Thank you to everyone who helped to take care of her amp my mother there,[],[],[],[]
Excellent service by the BKC Covid hospital thank you 🙏🏻,Excellent service by the BKC Covid hospital thank you ,[],[],[],['🙏🏻']
@ShashiTharoor Mr. Tharoor I am quite Apolitical but seeing a post like this from someone like you? Past 6 Q are almost all Covid impacted!, Mr Tharoor I am quite Apolitical but seeing a post like this from someone like you Past 6 Q are almost all Covid impacted,[],['@ShashiTharoor'],[],[]
"In this Covid era, I guess I’m gonna need one. Dildo ain’t doing shit to me",In this Covid era I guess I’m gonna need one Dildo ain’t doing shit to me,[],[],[],[]
"The Covid Vaccination Drive in Mumbai has degenerated into total chaos.  All 3 Govts- Centre,State and BMC need to get their act together  #CoWIN 4/4",The Covid Vaccination Drive in Mumbai has degenerated into total chaos All 3 Govts CentreState and BMC need to get their act together 4/4,['#CoWIN'],[],[],[]
"@7HillsHospital Had an excellent experience today afternoon of walk-in free covid vaccination at 7 Hills Hospital, Marol, Mumbai. Outstanding staff coordination, extremely polite &amp; helpful, well organised movement of Q's and comfortable arrangements for all.", Had an excellent experience today afternoon of walkin free covid vaccination at 7 Hills Hospital Marol Mumbai Outstanding staff coordination extremely polite amp helpful well organised movement of Qs and comfortable arrangements for all,[],['@7HillsHospital'],[],[]
"Stop pretending this is about encouraging sport post COVID, everyone. Although the five nations would make excellent hosts, this is about potential income, brash statements and preventing the break-up of the UK.  https://t.co/yn6QfOIQHD #WorldCup2030 #WorldCup",Stop pretending this is about encouraging sport post COVID everyone Although the five nations would make excellent hosts this is about potential income brash statements and preventing the breakup of the UK  ,"['#WorldCup2030', '#WorldCup']",[],['https://t.co/yn6QfOIQHD'],[]
President of Ukraine Volodymyr Zelensky @ZelenskyyUa was vaccinated today using Made-In-India Oxford/AstraZeneca (Covishield) covid vaccine.  https://t.co/KfqchHXnj3,President of Ukraine Volodymyr Zelensky was vaccinated today using MadeInIndia Oxford/AstraZeneca (Covishield) covid vaccine ,[],['@ZelenskyyUa'],['https://t.co/KfqchHXnj3'],[]
"Dear DrSurender Nikhil Gupta,  Congratulations! You are successfully administrated with 2nd Dose of COVID-19. You can download your provisional certificate at -  https://t.co/N9ARWieFNF. In case of any queries post vaccination , contact our help line at 1075 - CoWIN  No Prov Certi",Dear DrSurender Nikhil Gupta Congratulations You are successfully administrated with 2nd Dose of COVID19 You can download your provisional certificate at   In case of any queries post vaccination  contact our help line at 1075  CoWIN No Prov Certi,[],[],['https://t.co/N9ARWieFNF.'],[]
"@aryan66 Lols  Even they have no data..  no.of test list when court ask no data, no.of covid cases no data, no.of vaccines given no data, no.of vaccinated ones alive, side effects no data,  6years only things happening is Hussain sagar work lolz", Lols Even they have no data noof test list when court ask no data noof covid cases no data noof vaccines given no data noof vaccinated ones alive side effects no data 6years only things happening is Hussain sagar work lolz,[],['@aryan66'],[],[]
"Flash: Caribbean countries, being represented by St Lucia thanks India at WTO for sending Covid vaccines. Statement says ""This act of selflessness is testament to the solidarity of the government and People of India with CARICOM."" Full statement⤵️  https://t.co/AE9jmvEqU0",Flash: Caribbean countries being represented by St Lucia thanks India at WTO for sending Covid vaccines Statement says This act of selflessness is testament to the solidarity of the government and People of India with CARICOM Full statement ,[],[],['https://t.co/AE9jmvEqU0'],['⤵️']
"@balbir59 Sir we have had an awful 2020 with covid, we need some form of entertainment no?", Sir we have had an awful 2020 with covid we need some form of entertainment no,[],['@balbir59'],[],[]
@BbmpsplHealth Sir can you please educate us on latest quarantine rules for Asymptomatic COVID positive patients... 10/14/17 days...., Sir can you please educate us on latest quarantine rules for Asymptomatic COVID positive patients 10/14/17 days,[],['@BbmpsplHealth'],[],[]
"@rajeshtope11 @Dev_Fadnavis @AjitPawarSpeaks @rajeshtope11 # sir nashik has no testing goverment facility for covid rcpc test, all are sent to Aurangabad ,request you to have direct facility at nashik", # sir nashik has no testing goverment facility for covid rcpc test all are sent to Aurangabad request you to have direct facility at nashik,['#'],"['@rajeshtope11', '@Dev_Fadnavis', '@AjitPawarSpeaks', '@rajeshtope11']",[],[]
"@Dev_Fadnavis @AjitPawarSpeaks @rajeshtope11 # sir nashik has no testing goverment facility for covid rcpc test, all are sent to Aurangabad ,request you to have direct facility at nashik", # sir nashik has no testing goverment facility for covid rcpc test all are sent to Aurangabad request you to have direct facility at nashik,['#'],"['@Dev_Fadnavis', '@AjitPawarSpeaks', '@rajeshtope11']",[],[]
Traders flout Covid-19 guidelines; claim the disease is a myth   Check out my story on Thesoftcopy @iijnmbangalore    https://t.co/RaJH7Ukain    #corona #heath #bangalore,Traders flout Covid19 guidelines claim the disease is a myth Check out my story on Thesoftcopy  ,"['#corona', '#heath', '#bangalore']",['@iijnmbangalore'],['https://t.co/RaJH7Ukain'],[]
The Covid Protocols #WorldTradePark  https://t.co/5Gd9j0mVN3,The Covid Protocols ,['#WorldTradePark'],[],['https://t.co/5Gd9j0mVN3'],[]
"n addition to BMC centres, 29 pvt. hospital in Mumbai have been given permissions to carry out COVID Vaccination Drive. @CMOMaharashtra @AUThackeray  #MyBMCUpdates  https://t.co/cZDWTekvvv",n addition to BMC centres 29 pvt hospital in Mumbai have been given permissions to carry out COVID Vaccination Drive ,['#MyBMCUpdates'],"['@CMOMaharashtra', '@AUThackeray']",['https://t.co/cZDWTekvvv'],[]
"Imagine April 1st come and government be like "" April fools COVID was fake""🥲😳",Imagine April 1st come and government be like  April fools COVID was fake,[],[],[],"['🥲', '😳']"
"We are delighted to share that our CEO, Ms. Avani Singh, inaugrated the SpiceHealth COVID-19 #VaccineDrive!  We believe our frontline workers have shown great courage and worked tirelessly during these trying times, and deserve this!  https://t.co/pcG2ppUXjS",We are delighted to share that our CEO Ms Avani Singh inaugrated the SpiceHealth COVID19 We believe our frontline workers have shown great courage and worked tirelessly during these trying times and deserve this ,['#VaccineDrive!'],[],['https://t.co/pcG2ppUXjS'],[]
"Achieving an equal future in a COVID-19 World #WomensHistoryMonth #IWD2021  Photo :Nagar Valley, Hunza  https://t.co/4EJZTPGeW0",Achieving an equal future in a COVID19 World Photo :Nagar Valley Hunza ,"['#WomensHistoryMonth', '#IWD2021']",[],['https://t.co/4EJZTPGeW0'],[]
So when is kluster rentas negara? We only need 1 btw  Pls covid-19 do your job😉,So when is kluster rentas negara We only need 1 btw Pls covid19 do your job,[],[],[],['😉']
Grade 8 student @WendyGwalior campaigning to take care of the environment in Covid 19-Pandemic. #covid_19 #studentcampaign #environment #raiseyourvoice #stayhome #staysafe  https://t.co/t1vODvgfp9,Grade 8 student campaigning to take care of the environment in Covid 19Pandemic ,"['#covid_19', '#studentcampaign', '#environment', '#raiseyourvoice', '#stayhome', '#staysafe']",['@WendyGwalior'],['https://t.co/t1vODvgfp9'],[]
Bosnia accepting donation of 5000  vaccine doses from Serbia.   Covid has changed the world in many ways.,Bosnia accepting donation of 5000 vaccine doses from Serbia Covid has changed the world in many ways,[],[],[],[]
"After Covid break, flowers showered, candies distributed to welcome back students in schools across the state. On the first day of reopening of schools after nearly 11 months, #UPCM Shri @myogiadityanath Ji interacted with the braveheart kids.  https://t.co/lipH7r02D5",After Covid break flowers showered candies distributed to welcome back students in schools across the state On the first day of reopening of schools after nearly 11 months Shri Ji interacted with the braveheart kids ,['#UPCM'],['@myogiadityanath'],['https://t.co/lipH7r02D5'],[]
Celebrating Womanhood and learning during Covid Times as an entrepreneur. SUBURB breaking boundaries to go digital. @ Delhi/Gurgaon/NCR  https://t.co/Z3wsn5p82M,Celebrating Womanhood and learning during Covid Times as an entrepreneur SUBURB breaking boundaries to go digital @ Delhi/Gurgaon/NCR ,[],['@'],['https://t.co/Z3wsn5p82M'],[]
"""COVID-19 in India"" #coronavirus  https://t.co/jBpKIoau1B",COVID19 in India ,['#coronavirus'],[],['https://t.co/jBpKIoau1B'],[]
"@drmjabalpur @drmdhnecr @RailwaySeva Sir, train no.09608 detained at Gondawali since 20.45 just to give a way to a goods train resulting in unnecessary delay of the train arrivals at Singrauli . During this Covid it's seems unfair on the part of Railways for this act.", Sir train no09608 detained at Gondawali since 2045 just to give a way to a goods train resulting in unnecessary delay of the train arrivals at Singrauli  During this Covid its seems unfair on the part of Railways for this act,[],"['@drmjabalpur', '@drmdhnecr', '@RailwaySeva']",[],[]
"Had an excellent experience today afternoon of walk-in free covid vaccination at 7 Hills Hospital, Marol, Mumbai. Outstanding staff coordination, extremely polite &amp; helpful, well organised movement of Q's and comfortable arrangements for all.",Had an excellent experience today afternoon of walkin free covid vaccination at 7 Hills Hospital Marol Mumbai Outstanding staff coordination extremely polite amp helpful well organised movement of Qs and comfortable arrangements for all,[],[],[],[]
"AGDA hosted a productive #Next50Talks session that extensively discussed the impact of the Covid-19 pandemic during conflict and humanitarian crises, with a focus on the “triple vulnerability” group (conflict, Covid-19 &amp; climate), as well as the secondary impacts of the pandemic.  https://t.co/94fGqUlInY",AGDA hosted a productive session that extensively discussed the impact of the Covid19 pandemic during conflict and humanitarian crises with a focus on the “triple vulnerability” group (conflict Covid19 amp climate) as well as the secondary impacts of the pandemic ,['#Next50Talks'],[],['https://t.co/94fGqUlInY'],[]
6 positive covid,6 positive covid,[],[],[],[]
@VinGuptaMD can vaccinated person still transmit covid., can vaccinated person still transmit covid,[],['@VinGuptaMD'],[],[]
"Mr. Peter Maurer, President of the International Committee of the Red Cross @ICRC during “The Impact of the Covid-19 During Conflict and Humanitarian Crises” session.  https://t.co/dKZAThosMw",Mr Peter Maurer President of the International Committee of the Red Cross during “The Impact of the Covid19 During Conflict and Humanitarian Crises” session ,[],['@ICRC'],['https://t.co/dKZAThosMw'],[]
"@ARanganathan72 Best part is  Mumbai oldies cant wait If you dont have covid sit home relax, Go to work APNI SAFETY dekho Pr pr pr Aaj hi vaccine chaiye these are woke people with zero sense. Social distancing gayi tel lene Humko vaccine chaiye 😓 Sad to see such bright city with such peeps", Best part is Mumbai oldies cant wait If you dont have covid sit home relax Go to work APNI SAFETY dekho Pr pr pr Aaj hi vaccine chaiye these are woke people with zero sense Social distancing gayi tel lene Humko vaccine chaiye  Sad to see such bright city with such peeps,[],['@ARanganathan72'],[],['😓']
@srivathsacm  Today's video.  Place BKC. Mumbai. Event: covid vaccination.  https://t.co/JItyOrwXo4, Todays video Place BKC Mumbai Event: covid vaccination ,[],['@srivathsacm'],['https://t.co/JItyOrwXo4'],[]
Me on the first flight after this covid  https://t.co/JaYQnKdYuB,Me on the first flight after this covid ,[],[],['https://t.co/JaYQnKdYuB'],[]
"With a focus on the Covid crisis, innovation, India-Sweden to hold virtual summit  https://t.co/JInBqm43dT  @wionews",With a focus on the Covid crisis innovation IndiaSweden to hold virtual summit  ,[],['@wionews'],['https://t.co/JInBqm43dT'],[]
"BREAKING: Tickets on sale NOW for the 2021 Formula 1 Gulf Air #BahrainGP! A chance to witness #TheFirstEdition of F1 2021, from 26 to 28 March. Important note: Tickets are only available to vaccinated or COVID-19 recovered individuals. Visit  https://t.co/T9mOq5Taj0 for more info.  https://t.co/y5Rp5J6NHM",BREAKING: Tickets on sale NOW for the 2021 Formula 1 Gulf Air A chance to witness of F1 2021 from 26 to 28 March Important note: Tickets are only available to vaccinated or COVID19 recovered individuals Visit  for more info ,"['#BahrainGP!', '#TheFirstEdition']",[],"['https://t.co/T9mOq5Taj0', 'https://t.co/y5Rp5J6NHM']",[]
"Here is a complete list of countries India has sent covid vaccine so far. 47 countries from Caribbean to Asean, from Africa to Canada.  https://t.co/4O6HH9Ljjx",Here is a complete list of countries India has sent covid vaccine so far 47 countries from Caribbean to Asean from Africa to Canada ,[],[],['https://t.co/4O6HH9Ljjx'],[]
"India sends COVID vaccines to 47 countries - Canada gets 500k doses, Caribbean lauds generosity  https://t.co/NATNneCf1U",India sends COVID vaccines to 47 countries  Canada gets 500k doses Caribbean lauds generosity ,[],[],['https://t.co/NATNneCf1U'],[]
"India sends Covid vaccines to 47 countries; Canada gets 500,000, CARICOM region thank New Delhi's Generosity.  https://t.co/rOGC8P5Nhe  @wionews",India sends Covid vaccines to 47 countries Canada gets 500000 CARICOM region thank New Delhis Generosity  ,[],['@wionews'],['https://t.co/rOGC8P5Nhe'],[]
"Kuwait Daily Covid Cases Rise To 1,716 | Kuwait Local   https://t.co/vhBAigPara",Kuwait Daily Covid Cases Rise To 1716 | Kuwait Local ,[],[],['https://t.co/vhBAigPara'],[]
"Kuwait Daily Covid Cases Rise To 1,716 | Kuwait Local   https://t.co/vhBAigPara",Kuwait Daily Covid Cases Rise To 1716 | Kuwait Local ,[],[],['https://t.co/vhBAigPara'],[]
"Kuwait Daily Covid Cases Rise To 1,716 | Kuwait Local   https://t.co/vhBAigPara",Kuwait Daily Covid Cases Rise To 1716 | Kuwait Local ,[],[],['https://t.co/vhBAigPara'],[]
"Next Lockdown on the way -   ""Over 85% of new COVID-19 cases are from six states across India""   https://t.co/qPOHskg6Ru",Next Lockdown on the way  Over 85% of new COVID19 cases are from six states across India ,[],[],['https://t.co/qPOHskg6Ru'],[]
BallWork Drills #ACMilan #Fortnite #VaccinePassports #twitchstream #Malaysian #DemiPemulihanRI #vaccine #COVID19Vaccine #COVID #EuropaLeague #ChampionsLeague #UEFAChampionsLeague #MFLTransfer2021 #PremierLeague #PRELEMI #footballtime #EuropaLeague #ATMCHE #CHUANG2021 ￼  https://t.co/t8rsBM7cmK,BallWork Drills ￼ ,"['#ACMilan', '#Fortnite', '#VaccinePassports', '#twitchstream', '#Malaysian', '#DemiPemulihanRI', '#vaccine', '#COVID19Vaccine', '#COVID', '#EuropaLeague', '#ChampionsLeague', '#UEFAChampionsLeague', '#MFLTransfer2021', '#PremierLeague', '#PRELEMI', '#footballtime', '#EuropaLeague', '#ATMCHE', '#CHUANG2021']",[],['https://t.co/t8rsBM7cmK'],[]
"There are normally two sleeper trains to Chiang Mai every night, the new No.9 and the older No.13. As not so many people are traveling during COVID, only one sleeper train is running. Unfortunately it’s the old one as you can see from the photos. But still clean and comfortable.  https://t.co/rw4v6sK19Y",There are normally two sleeper trains to Chiang Mai every night the new No9 and the older No13 As not so many people are traveling during COVID only one sleeper train is running Unfortunately it’s the old one as you can see from the photos But still clean and comfortable ,[],[],['https://t.co/rw4v6sK19Y'],[]
"Phuket, Pattaya, and other foreign tourism reliant parts of Thailand pushing forward hard for priority of their local residents to be vaccinated for Covid-19 by September of 2021, in time for high season this year.   https://t.co/lFY6ntWRg7",Phuket Pattaya and other foreign tourism reliant parts of Thailand pushing forward hard for priority of their local residents to be vaccinated for Covid19 by September of 2021 in time for high season this year ,[],[],['https://t.co/lFY6ntWRg7'],[]
@IndiGo6E dear please tel me i have to go urgent in kolkata tomorrow but i am not able to get covid report as it take minimum 12hr plz help, dear please tel me i have to go urgent in kolkata tomorrow but i am not able to get covid report as it take minimum 12hr plz help,[],['@IndiGo6E'],[],[]
BAD NEWS..  HBL PSL 6 has been postponed after multiple positive Covid-19 cases.  https://t.co/AkY4GwP3mU,BAD NEWS HBL PSL 6 has been postponed after multiple positive Covid19 cases ,[],[],['https://t.co/AkY4GwP3mU'],[]
"Things were going perfect for PCB. Organised domestic matches, hosted Zimbabwe and SouthAfrica for bilateral series, completed PSL 5. And now once again entire tournament was about to played in Pakistan during Covid with spectators also allowed.",Things were going perfect for PCB Organised domestic matches hosted Zimbabwe and SouthAfrica for bilateral series completed PSL 5 And now once again entire tournament was about to played in Pakistan during Covid with spectators also allowed,[],[],[],[]
India donated one million doze of  Covid-19 vaccine Covishield to Nepal.This vaccine is made by Oxford and Astra Zeneca.The Government of India  has fixed the price of the vaccine Rs 250 per doze. Canada  has purchased two million doze of this vaccine.,India donated one million doze of Covid19 vaccine Covishield to NepalThis vaccine is made by Oxford and Astra ZenecaThe Government of India has fixed the price of the vaccine Rs 250 per doze Canada has purchased two million doze of this vaccine,[],[],[],[]
"""Over 85% of new COVID-19 cases are from six states across India""   https://t.co/h0Jyzm4JHm",Over 85% of new COVID19 cases are from six states across India ,[],[],['https://t.co/h0Jyzm4JHm'],[]
"@fekufakir @ParamveerChoud9 @arpaninto1 @BesuraTaansane @desimojito 1947: India received 93 cases of penicillin from Canada.  2021: Canada received 5 lakh doses of Covid-19 vaccines from India, 15 lakh more doses to be supplied soon.", 1947: India received 93 cases of penicillin from Canada 2021: Canada received 5 lakh doses of Covid19 vaccines from India 15 lakh more doses to be supplied soon,[],"['@fekufakir', '@ParamveerChoud9', '@arpaninto1', '@BesuraTaansane', '@desimojito']",[],[]
COVID-19 Malaysia Updates  https://t.co/8DjfxMgKbv,COVID19 Malaysia Updates ,[],[],['https://t.co/8DjfxMgKbv'],[]
Maharashtra blamed surge in #Covid_19 cases to #weddings. Marriages are truly made in heaven.    https://t.co/oIdZcJEH1J,Maharashtra blamed surge in cases to Marriages are truly made in heaven ,"['#Covid_19', '#weddings.']",[],['https://t.co/oIdZcJEH1J'],[]
A preprint providing important insights into the real-life post-COVID vaccination antibody response with COVISHIELD in India!  High antibody response was seen in a median duration of 28 days after the first dose!!  #Covishield #COVID19India #COVID19Vaccine  https://t.co/9WDaY3yvfV,A preprint providing important insights into the reallife postCOVID vaccination antibody response with COVISHIELD in India High antibody response was seen in a median duration of 28 days after the first dose ,"['#Covishield', '#COVID19India', '#COVID19Vaccine']",[],['https://t.co/9WDaY3yvfV'],[]
*PSL 6* Postponed 🥺 Meanwhile COVID-19 #PSL6 #pashawarzalmi #YellowStorm #TalhaZiaMTZ  https://t.co/CfoPPTbNAj,*PSL 6* Postponed  Meanwhile COVID19 ,"['#PSL6', '#pashawarzalmi', '#YellowStorm', '#TalhaZiaMTZ']",[],['https://t.co/CfoPPTbNAj'],['🥺']
COVID Vaccines Production by country!  https://t.co/9s39NPPaiV,COVID Vaccines Production by country ,[],[],['https://t.co/9s39NPPaiV'],[]
"#HumanCentric #Design.  Quotes from industry leaders applying #DesignThinking in Covid; ""Artists realised that they all need to come together, and the only way to do that is by helping each other and sharing the information with each other""@ssp10feb   https://t.co/sE0xsaZEzV", Quotes from industry leaders applying in Covid Artists realised that they all need to come together and the only way to do that is by helping each other and sharing the information with each other ,"['#HumanCentric', '#Design.', '#DesignThinking']",[],['https://t.co/sE0xsaZEzV'],[]
@Saranghae_peace I learnt dishes cleaning during COVID, I learnt dishes cleaning during COVID,[],['@Saranghae_peace'],[],[]
"79 new COVID-19 cases in J-K  #JMUSGR: Jammu and Kashmir on Thursday reported 79 new positive cases, taking tally to 126772.  14 from Jammu division, 65 from Kashmir division.  https://t.co/Gjm5dsAuJ7",79 new COVID19 cases in JK Jammu and Kashmir on Thursday reported 79 new positive cases taking tally to 126772 14 from Jammu division 65 from Kashmir division ,['#JMUSGR:'],[],['https://t.co/Gjm5dsAuJ7'],[]
