tweet,clean_tweet,hastags,attherate,urls,emojis
"The deadlier virus than corona virus is the human moron virus. You find them lurking around social media, infecting people with potent doses of misinformation! Symptoms: 0 facts, no data &amp; evidence, no sources, only biases &amp; misplaced nationalism. Oops missed verbal diarrhoea!",The deadlier virus than corona virus is the human moron virus You find them lurking around social media infecting people with potent doses of misinformation Symptoms: 0 facts no data amp evidence no sources only biases amp misplaced nationalism Oops missed verbal diarrhoea,[],[],[],[]
@onslaughtiscool They already know that corona is gonna happen so they are wearing a face mask for beauty and safety 😂, They already know that corona is gonna happen so they are wearing a face mask for beauty and safety ,[],['@onslaughtiscool'],[],['😂']
Corona Vaccine taken by Top Indian Politicians today .  #indianpolitician #india #corona #covi̇d19 #coronaupdates #coronapositive #coronavirus #coronavaccine  https://t.co/uJnGgiPRGT,Corona Vaccine taken by Top Indian Politicians today  ,"['#indianpolitician', '#india', '#corona', '#covi̇d19', '#coronaupdates', '#coronapositive', '#coronavirus', '#coronavaccine']",[],['https://t.co/uJnGgiPRGT'],[]
Corona Virus is less Dangerous than Modi Virus.  Now Covid 19 Virus penetrating into Another Virus. Which will become more  Dangerous for the Country.  Why he is not wearing Mask ??.,Corona Virus is less Dangerous than Modi Virus Now Covid 19 Virus penetrating into Another Virus Which will become more Dangerous for the Country Why he is not wearing Mask ,[],[],[],[]
Happy anniversary 1 year corona 🎉🎉🎉🎉  https://t.co/l8X00Wy7vz,Happy anniversary 1 year corona  ,[],[],['https://t.co/l8X00Wy7vz'],"['🎉', '🎉', '🎉', '🎉']"
@narendramodi Congratulations sir .Hope our country is Corona free soon., Congratulations sir Hope our country is Corona free soon,[],['@narendramodi'],[],[]
"@PMOIndia  The concerned authorities of department of atomic energy &amp; NPCIL trying kill me like Rohit vemula and Dr.Payaldadvi by creating severe mental agony, that too Corona virus period, I am being medical officer", The concerned authorities of department of atomic energy amp NPCIL trying kill me like Rohit vemula and DrPayaldadvi by creating severe mental agony that too Corona virus period I am being medical officer,[],['@PMOIndia'],[],[]
Fawad Ahmed a Pakistani Australian cricketer playing for Islamabad United in PSL6 tested positive for Corona today...!! May he Get well Soon...!!🌸 #IUvQG #QGvIU  https://t.co/Ljj5p2u6jQ,Fawad Ahmed a Pakistani Australian cricketer playing for Islamabad United in PSL6 tested positive for Corona today May he Get well Soon ,"['#IUvQG', '#QGvIU']",[],['https://t.co/Ljj5p2u6jQ'],['🌸']
@sudhirchaudhary Sirjee do a show on Petrol hike and cylinder price hike...We know our @PMOIndia Modi saab he can  do anything as he did for corona injection., Sirjee do a show on Petrol hike and cylinder price hikeWe know our Modi saab he can do anything as he did for corona injection,[],"['@sudhirchaudhary', '@PMOIndia']",[],[]
One Corona Positive Case In Team Of Islamabad United  Ly Others:-  https://t.co/q2bJs8XGsy,One Corona Positive Case In Team Of Islamabad United Ly Others: ,[],[],['https://t.co/q2bJs8XGsy'],[]
@narendramodi I salute to Our Honourable PM Modiji for leading from the front and getting our own Vaccine innoculated is  truly inspiring Person Myths about Vaccine.are totally vanished from our country I salute to you Sir for your dedication and commitment to make our India free From Corona, I salute to Our Honourable PM Modiji for leading from the front and getting our own Vaccine innoculated is truly inspiring Person Myths about Vaccineare totally vanished from our country I salute to you Sir for your dedication and commitment to make our India free From Corona,[],['@narendramodi'],[],[]
"The deadlier virus than corona virus is the human moron virus. You find them lurking around social media, infecting people with potent doses of misinformation! Symptoms: 0 facts, no data &amp; evidence, no sources, only biases &amp; misplaced nationalism. Oops missed verbal diarrhoea!",The deadlier virus than corona virus is the human moron virus You find them lurking around social media infecting people with potent doses of misinformation Symptoms: 0 facts no data amp evidence no sources only biases amp misplaced nationalism Oops missed verbal diarrhoea,[],[],[],[]
@onslaughtiscool They already know that corona is gonna happen so they are wearing a face mask for beauty and safety 😂, They already know that corona is gonna happen so they are wearing a face mask for beauty and safety ,[],['@onslaughtiscool'],[],['😂']
Corona Vaccine taken by Top Indian Politicians today .  #indianpolitician #india #corona #covi̇d19 #coronaupdates #coronapositive #coronavirus #coronavaccine  https://t.co/uJnGgiPRGT,Corona Vaccine taken by Top Indian Politicians today  ,"['#indianpolitician', '#india', '#corona', '#covi̇d19', '#coronaupdates', '#coronapositive', '#coronavirus', '#coronavaccine']",[],['https://t.co/uJnGgiPRGT'],[]
Corona Virus is less Dangerous than Modi Virus.  Now Covid 19 Virus penetrating into Another Virus. Which will become more  Dangerous for the Country.  Why he is not wearing Mask ??.,Corona Virus is less Dangerous than Modi Virus Now Covid 19 Virus penetrating into Another Virus Which will become more Dangerous for the Country Why he is not wearing Mask ,[],[],[],[]
Happy anniversary 1 year corona 🎉🎉🎉🎉  https://t.co/l8X00Wy7vz,Happy anniversary 1 year corona  ,[],[],['https://t.co/l8X00Wy7vz'],"['🎉', '🎉', '🎉', '🎉']"
@narendramodi Congratulations sir .Hope our country is Corona free soon., Congratulations sir Hope our country is Corona free soon,[],['@narendramodi'],[],[]
"@PMOIndia  The concerned authorities of department of atomic energy &amp; NPCIL trying kill me like Rohit vemula and Dr.Payaldadvi by creating severe mental agony, that too Corona virus period, I am being medical officer", The concerned authorities of department of atomic energy amp NPCIL trying kill me like Rohit vemula and DrPayaldadvi by creating severe mental agony that too Corona virus period I am being medical officer,[],['@PMOIndia'],[],[]
Fawad Ahmed a Pakistani Australian cricketer playing for Islamabad United in PSL6 tested positive for Corona today...!! May he Get well Soon...!!🌸 #IUvQG #QGvIU  https://t.co/Ljj5p2u6jQ,Fawad Ahmed a Pakistani Australian cricketer playing for Islamabad United in PSL6 tested positive for Corona today May he Get well Soon ,"['#IUvQG', '#QGvIU']",[],['https://t.co/Ljj5p2u6jQ'],['🌸']
@sudhirchaudhary Sirjee do a show on Petrol hike and cylinder price hike...We know our @PMOIndia Modi saab he can  do anything as he did for corona injection., Sirjee do a show on Petrol hike and cylinder price hikeWe know our Modi saab he can do anything as he did for corona injection,[],"['@sudhirchaudhary', '@PMOIndia']",[],[]
One Corona Positive Case In Team Of Islamabad United  Ly Others:-  https://t.co/q2bJs8XGsy,One Corona Positive Case In Team Of Islamabad United Ly Others: ,[],[],['https://t.co/q2bJs8XGsy'],[]
Share this to everyone and tell them to wear mask and make social distancing #ボス恋 #MaharashtraGovernment #MaharashtraFightsCorona #COVID19Vaccination #MaharashtraAssembly #MaharashtraCoronaVirusUpdates #Corona @MumbaiPolice @shirditourism @OfficeofUT @CMOMaharashtra,Share this to everyone and tell them to wear mask and make social distancing ,"['#ボス恋', '#MaharashtraGovernment', '#MaharashtraFightsCorona', '#COVID19Vaccination', '#MaharashtraAssembly', '#MaharashtraCoronaVirusUpdates', '#Corona']","['@MumbaiPolice', '@shirditourism', '@OfficeofUT', '@CMOMaharashtra']",[],[]
"@KTRTRS garu @trsharish garu,   THESE CONTRACT HAS BEEN GIVEN BY  COMMISSION PERSON SHESHIDHAR, BUT ON AUGUST 22ND 2019 STEAL AS GONE FOR REPLACEMENT BCZ IT WAS RUSTED  AND THESE PEOPLE KEPT US UNDER DARK SAYING  STEAL IS UNDER PROCESS TO WAIT, AFTER CORONA LOCKDOWN IN YEAR 2020", garu garu THESE CONTRACT HAS BEEN GIVEN BY COMMISSION PERSON SHESHIDHAR BUT ON AUGUST 22ND 2019 STEAL AS GONE FOR REPLACEMENT BCZ IT WAS RUSTED AND THESE PEOPLE KEPT US UNDER DARK SAYING STEAL IS UNDER PROCESS TO WAIT AFTER CORONA LOCKDOWN IN YEAR 2020,[],"['@KTRTRS', '@trsharish']",[],[]
"While the cab crossed park Street, I didn't see the outlet. Huh? They shut shop? When? How? Corona? Another one?   Questions swerved my mind as the intense summer heat just battered the city.",While the cab crossed park Street I didnt see the outlet Huh They shut shop When How Corona Another one Questions swerved my mind as the intense summer heat just battered the city,[],[],[],[]
"Donate Sanitary Napkins to underprivileged women.  It is estimated that over 80% of all women in India do not have access to sanitary products and they struggle a lot during their menstruation.Due to Corona and Lockdown, even feeding becomes a question for underprivileged women",Donate Sanitary Napkins to underprivileged women It is estimated that over 80% of all women in India do not have access to sanitary products and they struggle a lot during their menstruationDue to Corona and Lockdown even feeding becomes a question for underprivileged women,[],[],[],[]
@Adani_Elec_Mum That half part of money rs:19080 +balance security  deposit (cash)= rs:1380 you taking from me is totally opposite to the  rule of Corona period  but how does the money comes from you don't no ..... I taken a loan to pay this electricity bill.........🙏🙏 because it's my parpas..  https://t.co/dbLVoSloMJ, That half part of money rs:19080 +balance security deposit (cash)= rs:1380 you taking from me is totally opposite to the rule of Corona period but how does the money comes from you dont no  I taken a loan to pay this electricity bill because its my parpas ,[],['@Adani_Elec_Mum'],['https://t.co/dbLVoSloMJ'],"['🙏', '🙏']"
Please motivate elders in our homes to take #COVID19 vaccine. This single step is going to save many precious lives . Please don't pay attention to rumours being spread about #COVID19 vaccines . Lets convert this fight against Corona into a grand victory! #COVID19Vaccination 🇮🇳,Please motivate elders in our homes to take vaccine This single step is going to save many precious lives  Please dont pay attention to rumours being spread about vaccines  Lets convert this fight against Corona into a grand victory ,"['#COVID19', '#COVID19', '#COVID19Vaccination']",[],[],['🇮🇳']
Traders flout Covid-19 guidelines; claim the disease is a myth   Check out my story on Thesoftcopy @iijnmbangalore    https://t.co/RaJH7Ukain    #corona #heath #bangalore,Traders flout Covid19 guidelines claim the disease is a myth Check out my story on Thesoftcopy  ,"['#corona', '#heath', '#bangalore']",['@iijnmbangalore'],['https://t.co/RaJH7Ukain'],[]
"@anandmahindra Anandji if I had given a chance to build a mobilehome,my almost four year research &amp; experience would present a wonderful product that I designed with love you'll never regret.During corona lockdown I enquired from your Hyderabad dealership but none were interested", Anandji if I had given a chance to build a mobilehomemy almost four year research amp experience would present a wonderful product that I designed with love youll never regretDuring corona lockdown I enquired from your Hyderabad dealership but none were interested,[],['@anandmahindra'],[],[]
@narendramodi May his soul rest in peace.Have knowledge of Corona prevention as mark of respect for this great leader of India, May his soul rest in peaceHave knowledge of Corona prevention as mark of respect for this great leader of India,[],['@narendramodi'],[],[]
Corona Vaccine will be available 29 private hospital too.. So don't rush ..Vaccine is not the window seat in the local train..everyone will get it ..  #Mumbai,Corona Vaccine will be available 29 private hospital too So dont rush Vaccine is not the window seat in the local traineveryone will get it  ,['#Mumbai'],[],[],[]
"Respected Pope Francis plans to visit Iraq later this week. He has been warned of the rising 'Corona Virus' infections &amp; the fragile health care system.Iraq is the birth place of Abraham. His visit is also perceived as 'Veticans', relations bridging efforts with the muslim world.",Respected Pope Francis plans to visit Iraq later this week He has been warned of the rising Corona Virus infections amp the fragile health care systemIraq is the birth place of Abraham His visit is also perceived as Veticans relations bridging efforts with the muslim world,[],[],[],[]
"""CORONA Mukt Bharat"" ke liye we got our 1st  shot 💉 of COVAXIN. Thanks &amp; respect to our  @PMOIndia , GoI,Scientists, Doctors, 🏥 Hospitals &amp; all staffs 🙏 #Covaxin #COVID19Vaccine #IndiaFightsCorona  #COVID19India  https://t.co/3lpUOsCTPn",CORONA Mukt Bharat ke liye we got our 1st shot  of COVAXIN Thanks amp respect to our  GoIScientists Doctors  Hospitals amp all staffs  ,"['#Covaxin', '#COVID19Vaccine', '#IndiaFightsCorona', '#COVID19India']",['@PMOIndia'],['https://t.co/3lpUOsCTPn'],"['💉', '🏥', '🙏']"
"RESP . PM ,THE BEST  PM AFTER INDEPENDENCE...I SALUTE YOU FOR RESPECTING OUR SCIENTISTS BY CORONA VACCINATION DEVELOPED BY OUR SCIENTISTS....THANK YOU SIR.",RESP  PM THE BEST PM AFTER INDEPENDENCEI SALUTE YOU FOR RESPECTING OUR SCIENTISTS BY CORONA VACCINATION DEVELOPED BY OUR SCIENTISTSTHANK YOU SIR,[],[],[],[]
"@shanthak71 The elite can party cos they are all vaccinated and corona free,", The elite can party cos they are all vaccinated and corona free,[],['@shanthak71'],[],[]
@KDMCOfficial  I am unable to find center records available for Corona vaccination-Phase 2 for the pincode 421102 under KDMC Block in cowin portal.  Please guide further to avail this facility of Vaccination at the earliest., I am unable to find center records available for Corona vaccinationPhase 2 for the pincode 421102 under KDMC Block in cowin portal Please guide further to avail this facility of Vaccination at the earliest,[],['@KDMCOfficial'],[],[]
I was at that concert... I couldn't belive my eyes that Pablo was right there... I can't wait until this corona nightmare is over so we could all celebrate o ce again... #2yearsago,I was at that concert I couldnt belive my eyes that Pablo was right there I cant wait until this corona nightmare is over so we could all celebrate o ce again ,['#2yearsago'],[],[],[]
Only if you got in deep trouble know corona pandemic  https://t.co/gtLtSuMglm,Only if you got in deep trouble know corona pandemic ,[],[],['https://t.co/gtLtSuMglm'],[]
Today corona vaccine (covishield) 2nd dose completed thanks to Gov. of Gujarat and Gov. of India. Thank you narendra modi🙏🙏🇮🇳🇮🇳🇮🇳  https://t.co/6SPTH8HrHH,Today corona vaccine (covishield) 2nd dose completed thanks to Gov of Gujarat and Gov of India Thank you narendra modi ,[],[],['https://t.co/6SPTH8HrHH'],"['🙏', '🙏', '🇮🇳', '🇮🇳', '🇮🇳']"
"Is #Mumbai Free from #Corona ? @AnilDeshmukhNCP  For marriage Not More than 50 people, Didn't @OfficeofUT ask common people Lockdown lagana hai ki nahi? @OfficeofUT #uddhavthackeray  Who Gve Film Shooting Permission? @CPMumbaiPolice @MumbaiPolice  @Dev_Fadnavis @KiritSomaiya  https://t.co/cFGnSdmI0J",Is Free from  For marriage Not More than 50 people Didnt ask common people Lockdown lagana hai ki nahi Who Gve Film Shooting Permission ,"['#Mumbai', '#Corona', '#uddhavthackeray']","['@AnilDeshmukhNCP', '@OfficeofUT', '@OfficeofUT', '@CPMumbaiPolice', '@MumbaiPolice', '@Dev_Fadnavis', '@KiritSomaiya']",['https://t.co/cFGnSdmI0J'],[]
@DhoniGallery @ImShreya21 @msdhoni Isn't it dangerous as still corona isnkot completely over and also @msdhoni  will be joining camp. Please we don't wanr any bad news like previous year from @ChennaiIPL  camp, Isnt it dangerous as still corona isnkot completely over and also will be joining camp Please we dont wanr any bad news like previous year from camp,[],"['@DhoniGallery', '@ImShreya21', '@msdhoni', '@msdhoni', '@ChennaiIPL']",[],[]
@CMCCuttack Not done in ward no 17 after corona so please kindly do such operation in ward no 17. Buxi Bazar Police lane regiment Block back of Hanuman Mandir near club n club. Kindly mam @AnanyaDasIAS &amp; @CMCCuttack a humble request., Not done in ward no 17 after corona so please kindly do such operation in ward no 17 Buxi Bazar Police lane regiment Block back of Hanuman Mandir near club n club Kindly mam amp a humble request,[],"['@CMCCuttack', '@AnanyaDasIAS', '@CMCCuttack']",[],[]
Today's Corona Updates of Bardoli Nagar-Taluka ..  #bardoli #covid19 #coronavirus #coronavaccine #coronaupdate #bardolicorona #stayhomestaysafe #bardoliguide  https://t.co/iERTQAU13Q,Todays Corona Updates of Bardoli NagarTaluka  ,"['#bardoli', '#covid19', '#coronavirus', '#coronavaccine', '#coronaupdate', '#bardolicorona', '#stayhomestaysafe', '#bardoliguide']",[],['https://t.co/iERTQAU13Q'],[]
@AudimulapSuresh Kindly take a favourable decision towards our 98 dsc unemployed sir. During corona lock down many of us lost their private jobs sir. Those who are working are also not drawing their actual salaries sir. We are qualified teachers sir. Please  dont do like sri CBNsir please save us  https://t.co/jzOnTPWUN1, Kindly take a favourable decision towards our 98 dsc unemployed sir During corona lock down many of us lost their private jobs sir Those who are working are also not drawing their actual salaries sir We are qualified teachers sir Please dont do like sri CBNsir please save us ,[],['@AudimulapSuresh'],['https://t.co/jzOnTPWUN1'],[]
"@oyorooms I was also in oyo ,I worked in corona time also even when no one was ready to work at tht time. After that when things were getting normal at that time company asked for Resignation. yes this was reward for my loyalty 🙏 Now plz don't post thing like this , it hurts @riteshagar", I was also in oyo I worked in corona time also even when no one was ready to work at tht time After that when things were getting normal at that time company asked for Resignation yes this was reward for my loyalty  Now plz dont post thing like this  it hurts ,[],"['@oyorooms', '@riteshagar']",[],['🙏']
"Just when I  thought the number no of cases of corona deaths are dropping, my friend of last 13 years, lost the battle to covid. no words",Just when I thought the number no of cases of corona deaths are dropping my friend of last 13 years lost the battle to covid no words,[],[],[],[]
@satishacharya Got my signed copy of *Go Corona Go* today!! Looovvedd it 💕 Keep up the Awesome Work !! 👍  https://t.co/jC4eYYWRL8, Got my signed copy of *Go Corona Go* today Looovvedd it  Keep up the Awesome Work   ,[],['@satishacharya'],['https://t.co/jC4eYYWRL8'],"['💕', '👍']"
Rise in COVID cases.  #COVID19 #AndhraPradesh #Visakhapatnam #Vizag #LocalwireApp #Localwire #Corona #Covid #WearMask #SocialDistance  https://t.co/zWw3YRxOYK,Rise in COVID cases ,"['#COVID19', '#AndhraPradesh', '#Visakhapatnam', '#Vizag', '#LocalwireApp', '#Localwire', '#Corona', '#Covid', '#WearMask', '#SocialDistance']",[],['https://t.co/zWw3YRxOYK'],[]
الحَمْدُ ِلله کرونا سے نجات مل گیا۔ There is one consolation in being sick; and that is the possibility that you may recover to a better state than you were ever in before #covid #coronavirus #corona #staysafe #stayathome #lockdown #Recvered #quarantine #SocialDistance  #healthy  https://t.co/OVSZcGe0Lr,الحَمْدُ ِلله کرونا سے نجات مل گیا۔ There is one consolation in being sick and that is the possibility that you may recover to a better state than you were ever in before ,"['#covid', '#coronavirus', '#corona', '#staysafe', '#stayathome', '#lockdown', '#Recvered', '#quarantine', '#SocialDistance', '#healthy']",[],['https://t.co/OVSZcGe0Lr'],[]
As per the guidelines of @CMOMaharashtra masks were being distributed on the backdrop of rising corona in the city and areas nearby to aware the people under the guidance of mla @iYogeshRKadam.  https://t.co/7r2ltSkxuT,As per the guidelines of masks were being distributed on the backdrop of rising corona in the city and areas nearby to aware the people under the guidance of mla ,[],"['@CMOMaharashtra', '@iYogeshRKadam.']",['https://t.co/7r2ltSkxuT'],[]
"@TOIDelhi @LambaAlka There is no corona in Hindutan, all is politics now", There is no corona in Hindutan all is politics now,[],"['@TOIDelhi', '@LambaAlka']",[],[]
@Mehak_Sareen Third cog - political rallies! Their ain’t no corona when this is happening!, Third cog  political rallies Their ain’t no corona when this is happening,[],['@Mehak_Sareen'],[],[]
Can’t remember the last time I’ve been to a proper restaurant. #corona😾,Can’t remember the last time I’ve been to a proper restaurant ,['#corona😾'],[],[],[]
"@aanganwadiawwup @bjpswatisingh @UPGovt @smritiirani @myogiadityanath @PMOIndia @narendramodi @anandibenpatel govt paying 150rs/day to @DelhiIcds worker in UP. Is this justifiable❓  They have #jangadna , #polio , #corona_survey, #election_duty and many more.   @icds_up  are you doing justis with Anganwadi worker  @WHO @WorldBank @WorldBankIndia @CMOfficeUP @UPGovt", govt paying 150rs/day to worker in UP Is this justifiable They have   and many more are you doing justis with Anganwadi worker ,"['#jangadna', '#polio', '#corona_survey,', '#election_duty']","['@aanganwadiawwup', '@bjpswatisingh', '@UPGovt', '@smritiirani', '@myogiadityanath', '@PMOIndia', '@narendramodi', '@anandibenpatel', '@DelhiIcds', '@icds_up', '@WHO', '@WorldBank', '@WorldBankIndia', '@CMOfficeUP', '@UPGovt']",[],['❓']
"@PinkiTy70939894 @AnganwadiKanpur @narendramodi @anandibenpatel govt paying 150rs/day to @DelhiIcds worker in UP. Is this justifiable❓  They have #jangadna , #polio , #corona_survey, #election_duty and many more.   @icds_up  are you doing justis with Anganwadi worker  @WHO @WHO_Europe @WorldBank @WorldBankIndia", govt paying 150rs/day to worker in UP Is this justifiable They have   and many more are you doing justis with Anganwadi worker ,"['#jangadna', '#polio', '#corona_survey,', '#election_duty']","['@PinkiTy70939894', '@AnganwadiKanpur', '@narendramodi', '@anandibenpatel', '@DelhiIcds', '@icds_up', '@WHO', '@WHO_Europe', '@WorldBank', '@WorldBankIndia']",[],['❓']
"@VinayVe76008647 @AnganwadiKanpur @anandibenpatel govt paying 150rs/day to @DelhiIcds worker in UP. Is this justifiable❓  They have #jangadna , #polio , #corona_survey, #election_duty and many more.   @icds_up  are you doing justis with Anganwadi worker", govt paying 150rs/day to worker in UP Is this justifiable They have   and many more are you doing justis with Anganwadi worker,"['#jangadna', '#polio', '#corona_survey,', '#election_duty']","['@VinayVe76008647', '@AnganwadiKanpur', '@anandibenpatel', '@DelhiIcds', '@icds_up']",[],['❓']
"@aanganwadiawwup @AnganwadiKanpur @myogiadityanath @bjpswatisingh @anandibenpatel govt paying 150rs/day to @DelhiIcds worker in UP. Is this justifiable❓  They have #jangadna , #polio , #corona_survey, #election_duty and many more.   @icds_up  are you doing justis with Anganwadi worker", govt paying 150rs/day to worker in UP Is this justifiable They have   and many more are you doing justis with Anganwadi worker,"['#jangadna', '#polio', '#corona_survey,', '#election_duty']","['@aanganwadiawwup', '@AnganwadiKanpur', '@myogiadityanath', '@bjpswatisingh', '@anandibenpatel', '@DelhiIcds', '@icds_up']",[],['❓']
"@VinayVe76008647 @AnganwadiKanpur @narendramodi @bjpswatisingh @myogiadityanath @smritiirani @anandibenpatel govt paying 150rs/day to @DelhiIcds worker in UP. Is this justifiable❓  They have #jangadna , #polio , #corona_survey, #election_duty and many more.   @icds_up  are you doing justis with Anganwadi worker", govt paying 150rs/day to worker in UP Is this justifiable They have   and many more are you doing justis with Anganwadi worker,"['#jangadna', '#polio', '#corona_survey,', '#election_duty']","['@VinayVe76008647', '@AnganwadiKanpur', '@narendramodi', '@bjpswatisingh', '@myogiadityanath', '@smritiirani', '@anandibenpatel', '@DelhiIcds', '@icds_up']",[],['❓']
Corona virus update  04.03.2021  https://t.co/SGcZe48Gns,Corona virus update 04032021 ,[],[],['https://t.co/SGcZe48Gns'],[]
@dckoderma @JharkhandCMO @MoHFW_INDIA @ManishHardwork1 @prdjharkhand @IprdKoderma Hope door to door person should be corona vacationed.., Hope door to door person should be corona vacationed,[],"['@dckoderma', '@JharkhandCMO', '@MoHFW_INDIA', '@ManishHardwork1', '@prdjharkhand', '@IprdKoderma']",[],[]
@koulrohit2016 @kunalkamra88 And they will come back again next month to give Rs 250 more for the next shot of  Corona Vaccine Shot..., And they will come back again next month to give Rs 250 more for the next shot of Corona Vaccine Shot,[],"['@koulrohit2016', '@kunalkamra88']",[],[]
"*Sirmaur Corona Sample Details*   RTPCR pending 20, positive 4  RTPCR New 531, positive 0, Inprocess 48  Trunat 0  Sai hospital TNC 1, positive 0  Sai hospital RAT 0, Positive 0  RAT 147, positive 4  Total sample 679, Positive 8  Recovered 6  Active 38  #COVID19 #7pmmediabulletin  https://t.co/mXJPOraTk3",*Sirmaur Corona Sample Details* RTPCR pending 20 positive 4 RTPCR New 531 positive 0 Inprocess 48 Trunat 0 Sai hospital TNC 1 positive 0 Sai hospital RAT 0 Positive 0 RAT 147 positive 4 Total sample 679 Positive 8 Recovered 6 Active 38 ,"['#COVID19', '#7pmmediabulletin']",[],['https://t.co/mXJPOraTk3'],[]
