tweet,clean_tweet,hastags,attherate,urls,emojis
Pfizer executive says EU export restrictions on COVID-19 vaccines would be a 'lose-lose' situation  https://t.co/pzPM4MLKOT #Sipgrab #UnitingPeopleWithThePossibilities,Pfizer executive says EU export restrictions on COVID19 vaccines would be a loselose situation  ,"['#Sipgrab', '#UnitingPeopleWithThePossibilities']",[],['https://t.co/pzPM4MLKOT'],[]
Rutgers University to require Covid vaccine for students returning to campus in the fall  https://t.co/HSRwtDPGZR #Nifty #Sipgrab #UnitingPeopleWithThePossibilities,Rutgers University to require Covid vaccine for students returning to campus in the fall  ,"['#Nifty', '#Sipgrab', '#UnitingPeopleWithThePossibilities']",[],['https://t.co/HSRwtDPGZR'],[]
So far 5 cr.Covind Vaccinations are administered in entire India where as 6 cr.vaccine doses are exported. Improve the administration of Vaccines to our people #CovidVaccine @incindia @inctelangana,So far 5 crCovind Vaccinations are administered in entire India where as 6 crvaccine doses are exported Improve the administration of Vaccines to our people ,['#CovidVaccine'],"['@incindia', '@inctelangana']",[],[]
How do #VaccinesWork❓  1⃣ Vaccines contain weakened non-dangerous parts of an antigen 2⃣ It's enough that our body can learn to build the specific antibody 3⃣ This will prompt our immune system to respond &amp; defeat the real antigen in the future.  #COVID19  https://t.co/HU3h1lHJmI,How do  Vaccines contain weakened nondangerous parts of an antigen  Its enough that our body can learn to build the specific antibody  This will prompt our immune system to respond amp defeat the real antigen in the future ,"['#VaccinesWork❓', '#COVID19']",[],['https://t.co/HU3h1lHJmI'],"['1⃣', '2⃣', '3⃣']"
@tweep_tweep_ Nice To met You actually i am not feeling well today having body pain because i was take vaccines second dose, Nice To met You actually i am not feeling well today having body pain because i was take vaccines second dose,[],['@tweep_tweep_'],[],[]
Pfizer begins Covid vaccine trial on infants and young kids  https://t.co/VTGJhjoOka #Nifty #Sipgrab #UnitingPeopleWithThePossibilities,Pfizer begins Covid vaccine trial on infants and young kids  ,"['#Nifty', '#Sipgrab', '#UnitingPeopleWithThePossibilities']",[],['https://t.co/VTGJhjoOka'],[]
"Next Avenue: I’m grateful for my vaccine, but is it really something to celebrate?  https://t.co/5872Y3kaTd #Nifty #Sipgrab #UnitingPeopleWithThePossibilities",Next Avenue: I’m grateful for my vaccine but is it really something to celebrate  ,"['#Nifty', '#Sipgrab', '#UnitingPeopleWithThePossibilities']",[],['https://t.co/5872Y3kaTd'],[]
Exclusive: Novavax delays EU vaccine supply deal amid production problems - source  https://t.co/Mut8astaTh #Sipgrab #UnitingPeopleWithThePossibilities,Exclusive: Novavax delays EU vaccine supply deal amid production problems  source  ,"['#Sipgrab', '#UnitingPeopleWithThePossibilities']",[],['https://t.co/Mut8astaTh'],[]
COVID vaccination drive phase III will begin from April 1  • Every person aged 45 years and above can take the vaccine.  • Over 5 crore people have vaccinated so far.  Defeat hesitancy and take the COVID vaccine.  #LargestVaccinationDrive #IndiaFightsCorona,COVID vaccination drive phase III will begin from April 1 • Every person aged 45 years and above can take the vaccine • Over 5 crore people have vaccinated so far Defeat hesitancy and take the COVID vaccine ,"['#LargestVaccinationDrive', '#IndiaFightsCorona']",[],[],[]
That means The people are right Counterfeit vaccines and counterfeit PM @ImranKhanPTI  @BBhuttoZardari @BakhtawarBZ @AseefaBZ @FerozeJamali @ImZuhaira @ShafaqRajpar @akbar_fareeha @psfanam @SabaHyder1 @MirBabarLoond @SyedNasirHShah @NazBaloch_ @Nazfarooque @KafiaS @PalwashaKhan18  https://t.co/vd5UOaVBhm,That means The people are right Counterfeit vaccines and counterfeit PM ,[],"['@ImranKhanPTI', '@BBhuttoZardari', '@BakhtawarBZ', '@AseefaBZ', '@FerozeJamali', '@ImZuhaira', '@ShafaqRajpar', '@akbar_fareeha', '@psfanam', '@SabaHyder1', '@MirBabarLoond', '@SyedNasirHShah', '@NazBaloch_', '@Nazfarooque', '@KafiaS', '@PalwashaKhan18']",['https://t.co/vd5UOaVBhm'],[]
Coronavirus and the money behind vaccines | FT Film  https://t.co/BGr713sc2K via @YouTube,Coronavirus and the money behind vaccines | FT Film  via ,[],['@YouTube'],['https://t.co/BGr713sc2K'],[]
"MADRAC should publish AEFI data in M’sia. Pharmacovigilance team collates the C19 Vaccines AEFI data (from MySejahtera, PhIS, ConSerf, NPRA website) daily. It may address VACCINE hesitancy. TRANSPARENCY &amp; TRUST are pillars in a meaningful relationship. @DrAdhamBaba @Khairykj",MADRAC should publish AEFI data in M’sia Pharmacovigilance team collates the C19 Vaccines AEFI data (from MySejahtera PhIS ConSerf NPRA website) daily It may address VACCINE hesitancy TRANSPARENCY amp TRUST are pillars in a meaningful relationship ,[],"['@DrAdhamBaba', '@Khairykj']",[],[]
WTA urges players to get COVID-19 vaccine  https://t.co/xxYbqu6deg #Sipgrab #UnitingPeopleWithThePossibilities,WTA urges players to get COVID19 vaccine  ,"['#Sipgrab', '#UnitingPeopleWithThePossibilities']",[],['https://t.co/xxYbqu6deg'],[]
Sindh Govt to buy Cansino vaccine worth Rs500 million directly from China: Health Minister - Sindh   https://t.co/WLe6JemNz0,Sindh Govt to buy Cansino vaccine worth Rs500 million directly from China: Health Minister  Sindh ,[],[],['https://t.co/WLe6JemNz0'],[]
@marvisirmed Do u support Iffats bypassing vaccine line marvi?, Do u support Iffats bypassing vaccine line marvi,[],['@marvisirmed'],[],[]
NIH study shows promising Covid results against some variants that could be good news for vaccines  https://t.co/sC9JaXHqVc #Nifty #Sipgrab #UnitingPeopleWithThePossibilities,NIH study shows promising Covid results against some variants that could be good news for vaccines  ,"['#Nifty', '#Sipgrab', '#UnitingPeopleWithThePossibilities']",[],['https://t.co/sC9JaXHqVc'],[]
"If you are eligible and have access, please get vaccinated. Also plz note that vaccine is only effective after 28 days of 2nd dose. Even with vaccine, one can still get covid and transmit. Vaccine only helps your body fight virus better. So please continue to follow SOPs.",If you are eligible and have access please get vaccinated Also plz note that vaccine is only effective after 28 days of 2nd dose Even with vaccine one can still get covid and transmit Vaccine only helps your body fight virus better So please continue to follow SOPs,[],[],[],[]
Finally completed 28 days after my 2nd dose of vaccine. Alhamdulillah!,Finally completed 28 days after my 2nd dose of vaccine Alhamdulillah,[],[],[],[]
Just posted a video @ The Vaccine  https://t.co/d6KEXO2yFt,Just posted a video @ The Vaccine ,[],['@'],['https://t.co/d6KEXO2yFt'],[]
"Personal Finance Daily: What to know about vaccine passports, and 1 million borrowers ‘ignored by Washington’ now eligible for COVID-related pause on student debt and collections  https://t.co/cLijQwpf7r #Nifty #Sipgrab #UnitingPeopleWithThePossibilities",Personal Finance Daily: What to know about vaccine passports and 1 million borrowers ‘ignored by Washington’ now eligible for COVIDrelated pause on student debt and collections  ,"['#Nifty', '#Sipgrab', '#UnitingPeopleWithThePossibilities']",[],['https://t.co/cLijQwpf7r'],[]
Went out to my first non-family outing in over a year which was out in the open air.  I was comfortable because almost everyone had the vaccine.  Maybe life will return to normal soon...,Went out to my first nonfamily outing in over a year which was out in the open air I was comfortable because almost everyone had the vaccine Maybe life will return to normal soon,[],[],[],[]
GSK to support manufacture of Novavax' COVID-19 vaccine  https://t.co/FELgUv340Q #Nifty #sipgrab,GSK to support manufacture of Novavax COVID19 vaccine  ,"['#Nifty', '#sipgrab']",[],['https://t.co/FELgUv340Q'],[]
@narendramodi Ji.. World knows that you have got single dose of vaccine and not double... Please learn from your Bangladeshi counterpart and please #WearAMask. Lot of Indians value your life alot.. Besides don't want to send wrong message to 100 crore Indians.. #IndiaFightsCorona  https://t.co/jPjuDKidUo, Ji World knows that you have got single dose of vaccine and not double Please learn from your Bangladeshi counterpart and please Lot of Indians value your life alot Besides dont want to send wrong message to 100 crore Indians ,"['#WearAMask.', '#IndiaFightsCorona']",['@narendramodi'],['https://t.co/jPjuDKidUo'],[]
Build awareness of the vaccine now. Convert this situation into ab opportunity to go door to door and get people to the vaccination centres.,Build awareness of the vaccine now Convert this situation into ab opportunity to go door to door and get people to the vaccination centres,[],[],[],[]
"India should use its vast experience to speed up the administering of the COVID vaccine. No awareness has been created around the vaccine. Leave scepticism, ordinary people don't know about its importance. When cases are on the rise, all exports of the vaccine needs to stop.",India should use its vast experience to speed up the administering of the COVID vaccine No awareness has been created around the vaccine Leave scepticism ordinary people dont know about its importance When cases are on the rise all exports of the vaccine needs to stop,[],[],[],[]
"#Covid_19 #Pune #COVID19 Halt COVID Vaccine Diplomacy, Focus On “India First”  https://t.co/LWbiQgpjUI", Halt COVID Vaccine Diplomacy Focus On “India First” ,"['#Covid_19', '#Pune', '#COVID19']",[],['https://t.co/LWbiQgpjUI'],[]
@SanaullahDawn @Xadeejournalist We need vaccine 💉....!, We need vaccine ,[],"['@SanaullahDawn', '@Xadeejournalist']",[],['💉']
@MajorPoonia @OfficialDGISPR @hrw @UNHumanRights why Govt is providing vaccine to Pak  and sending Get well soon letter to Pak PM?, why Govt is providing vaccine to Pak and sending Get well soon letter to Pak PM,[],"['@MajorPoonia', '@OfficialDGISPR', '@hrw', '@UNHumanRights']",[],[]
@priyankac19 But don’t you feel on door to door vaccine it’s a concern because after vaccination the patients need to be under observation for 30-40 min &amp; would this not reduce the speed which can be done at centre. Yes the centre govt should make it available for 24hrs 1/2, But don’t you feel on door to door vaccine it’s a concern because after vaccination the patients need to be under observation for 3040 min amp would this not reduce the speed which can be done at centre Yes the centre govt should make it available for 24hrs 1/2,[],['@priyankac19'],[],[]
"Nothing, just me and bois thinking, Why lockdown is needed, when we have Vaccine.. 🤷‍♂️ #lockdown #MaharashtraGovernment #Pune #pmc  https://t.co/tRhqYWXlvp",Nothing just me and bois thinking Why lockdown is needed when we have Vaccine  ,"['#lockdown', '#MaharashtraGovernment', '#Pune', '#pmc']",[],['https://t.co/tRhqYWXlvp'],['🤷\u200d♂️']
"Number of coronavirus recoveries in Kuwait rose by 964 over the past 24 hours putting whole figure of recuperated at 181,119, the Ministry of Health (MoH) said on Tuesday.  https://t.co/K8iKyv0qLp",Number of coronavirus recoveries in Kuwait rose by 964 over the past 24 hours putting whole figure of recuperated at 181119 the Ministry of Health (MoH) said on Tuesday ,[],[],['https://t.co/K8iKyv0qLp'],[]
"Alhamdullilah!  Despite a player got POSITIVE, PSL is going on.  Let's beat Coronavirus together!",Alhamdullilah Despite a player got POSITIVE PSL is going on Lets beat Coronavirus together,[],[],[],[]
CHINA ATTACK INDIA DURING  CORONAVIRUS THE MOST DANGEROU S THING A COUNTRY CAN DO,CHINA ATTACK INDIA DURING CORONAVIRUS THE MOST DANGEROU S THING A COUNTRY CAN DO,[],[],[],[]
"Respected Pope Francis plans to visit Iraq later this week. He has been warned of the rising 'Corona Virus' infections &amp; the fragile health care system.Iraq is the birth place of Abraham. His visit is also perceived as 'Veticans', relations bridging efforts with the muslim world.",Respected Pope Francis plans to visit Iraq later this week He has been warned of the rising Corona Virus infections amp the fragile health care systemIraq is the birth place of Abraham His visit is also perceived as Veticans relations bridging efforts with the muslim world,[],[],[],[]
"""COVID-19 in India"" #coronavirus  https://t.co/jBpKIoau1B",COVID19 in India ,['#coronavirus'],[],['https://t.co/jBpKIoau1B'],[]
"Rajnath gets his covaxin jab  NEW DELHI: Defence Minister Rajnath Singh took the first dose of the coronavirus vaccine at the Army's Research and Referral Hospital in New Delhi on Tuesday, a day after the start of the second phase of the inoculation drive. @rajnathsingh  https://t.co/3prIYH1Axo",Rajnath gets his covaxin jab NEW DELHI: Defence Minister Rajnath Singh took the first dose of the coronavirus vaccine at the Armys Research and Referral Hospital in New Delhi on Tuesday a day after the start of the second phase of the inoculation drive ,[],['@rajnathsingh'],['https://t.co/3prIYH1Axo'],[]
"The music industry had a way to grow amidst 'Corona Virus'. The overall music revenue increased by 9.2 % and touched US $ 12.2 billion in the year 2020, as per, ' Recording Industry Association of America' . Much came from the streaming industry.",The music industry had a way to grow amidst Corona Virus The overall music revenue increased by 92 % and touched US $ 122 billion in the year 2020 as per  Recording Industry Association of America  Much came from the streaming industry,[],[],[],[]
Coronavirus is not over yet.  Stay Safe and continue to.. 🔹Wash your hands 🔹Wear Face Mask 🔹Maintain Social Distance 🔹Limit traveling Dont underestimate #COVID19! Viruses spread quickly - Be Vigilant❗ #COVID #COVID19LK #LKA #SriLanka #COVID19SL  https://t.co/ZMU7uhSzRx,Coronavirus is not over yet Stay Safe and continue to Wash your hands Wear Face Mask Maintain Social Distance Limit traveling Dont underestimate Viruses spread quickly  Be Vigilant ,"['#COVID19!', '#COVID', '#COVID19LK', '#LKA', '#SriLanka', '#COVID19SL']",[],['https://t.co/ZMU7uhSzRx'],"['🔹', '🔹', '🔹', '🔹', '❗']"
"Coronavirus crisis unlikely to be over by the end of the year, WHO warns  https://t.co/4frWVxoM7l",Coronavirus crisis unlikely to be over by the end of the year WHO warns ,[],[],['https://t.co/4frWVxoM7l'],[]
"JK reports 85 new positive cases, 123811 recovered so far  #JAMMU-The Government on Tuesday informed that 85 new positive cases of novel Corona virus (COVID-19), 12from Jammu division and 73 from Kashmir division.  https://t.co/t8lRE2j1mv",JK reports 85 new positive cases 123811 recovered so far Government on Tuesday informed that 85 new positive cases of novel Corona virus (COVID19) 12from Jammu division and 73 from Kashmir division ,['#JAMMU-The'],[],['https://t.co/t8lRE2j1mv'],[]
Someone punish them for not wearing masks and spreading Corona virus! #MaskUp #WearAMask,Someone punish them for not wearing masks and spreading Corona virus ,"['#MaskUp', '#WearAMask']",[],[],[]
The international development and aid arms of governments in the richest countries must act now to ensure that no-one is left behind in coronavirus vaccine roll-out.,The international development and aid arms of governments in the richest countries must act now to ensure that noone is left behind in coronavirus vaccine rollout,[],[],[],[]
"As countries scramble for access to vaccines with the hope of breaking out of the cycles of epidemic flare-ups and economically damaging lockdowns and high mortality from coronavirus, vaccine prices could be pushed up as richer countries try to jump to the front of the queue.",As countries scramble for access to vaccines with the hope of breaking out of the cycles of epidemic flareups and economically damaging lockdowns and high mortality from coronavirus vaccine prices could be pushed up as richer countries try to jump to the front of the queue,[],[],[],[]
"Similar imbalances are emerging at the time of writing in the early days of coronavirus vaccination. For example, whereas 25% of people with Israeli identity cards have received the Pfizer vaccine, none of 4 million Palestinians has received a dose of vaccine.",Similar imbalances are emerging at the time of writing in the early days of coronavirus vaccination For example whereas 25% of people with Israeli identity cards have received the Pfizer vaccine none of 4 million Palestinians has received a dose of vaccine,[],[],[],[]
Stay Safe🙏🏻 #coronavirus #CoronaVirusUpdates #healthcare #WearYourMask #WearAMask #WashYourHands #SocialDistancing  https://t.co/QjeW73GRSn,Stay Safe ,"['#coronavirus', '#CoronaVirusUpdates', '#healthcare', '#WearYourMask', '#WearAMask', '#WashYourHands', '#SocialDistancing']",[],['https://t.co/QjeW73GRSn'],['🙏🏻']
Another six locations are being concidered to bury coronavirus victims. Reports said that the six locations include areas in Puttalam and Mannar. #Srilanka #lka #stopforcedcremations #COVID19 #Covid_19,Another six locations are being concidered to bury coronavirus victims Reports said that the six locations include areas in Puttalam and Mannar ,"['#Srilanka', '#lka', '#stopforcedcremations', '#COVID19', '#Covid_19']",[],[],[]
"#Telangana - 163 new #COVID19 cases, 157 Recoveries &amp; 1 death reported in State till 8pm of 1st March. Now Total cases in state rises to 2,99,086 including 2,95,544 Cured/Recovered, 1907 Active Cases &amp;  1635 Fatalities - State Health Dept #coronavirus @News18MP @News18CG  https://t.co/KexblspU23",  163 new cases 157 Recoveries amp 1 death reported in State till 8pm of 1st March Now Total cases in state rises to 299086 including 295544 Cured/Recovered 1907 Active Cases amp 1635 Fatalities  State Health Dept ,"['#Telangana', '#COVID19', '#coronavirus']","['@News18MP', '@News18CG']",['https://t.co/KexblspU23'],[]
"#HimachalPradesh - 4 new #COVID19 +ve cases, 20 Discharges &amp; No Death reported in state today till 2pm.  Now Total cases in state rises to 58,781 including 57,367 Cured/ Discharged, 418 Active Cases &amp; 983 Deceased -State Health Dept  #coronavirus @News18MP @News18CG  https://t.co/S5TuoFwUOS",  4 new +ve cases 20 Discharges amp No Death reported in state today till 2pm Now Total cases in state rises to 58781 including 57367 Cured/ Discharged 418 Active Cases amp 983 Deceased State Health Dept ,"['#HimachalPradesh', '#COVID19', '#coronavirus']","['@News18MP', '@News18CG']",['https://t.co/S5TuoFwUOS'],[]
Your coronavirus vaccine guide: Covishield vs Covaxin   https://t.co/dMOUKjQmVl   Download Economic Times App to stay updated with Business News -  https://t.co/nEWHI5fjSy  https://t.co/DrsHIJpKQE,Your coronavirus vaccine guide: Covishield vs Covaxin  Download Economic Times App to stay updated with Business News   ,[],[],"['https://t.co/dMOUKjQmVl', 'https://t.co/nEWHI5fjSy', 'https://t.co/DrsHIJpKQE']",[]
Get your #medicines right at your #doorstep by skipping your #travellings   Get 10% - 15% off on your medicines   Install app now -  https://t.co/dDytMEjEwi  #COVID19Vaccine #vaccine #Bangalore #LOVE_or_TAKE #belgaum #Pune #Belagavi #coronavirus #COVID19 #NationalScienceDay *tnc  https://t.co/YwXnR43iVo,Get your right at your by skipping your Get 10%  15% off on your medicines Install app now   *tnc ,"['#medicines', '#doorstep', '#travellings', '#COVID19Vaccine', '#vaccine', '#Bangalore', '#LOVE_or_TAKE', '#belgaum', '#Pune', '#Belagavi', '#coronavirus', '#COVID19', '#NationalScienceDay']",[],"['https://t.co/dDytMEjEwi', 'https://t.co/YwXnR43iVo']",[]
#Argentina  Thousands protest in Argentina's Buenos Aires against handling of covid-19 VIP vaccination scandal and took to streets  placing fake body bags outside government offices symbolising coronavirus deaths.  https://t.co/hA29CHFTqD, Thousands protest in Argentinas Buenos Aires against handling of covid19 VIP vaccination scandal and took to streets placing fake body bags outside government offices symbolising coronavirus deaths ,['#Argentina'],[],['https://t.co/hA29CHFTqD'],[]
Consult Today itself...  #hospital #covid #doctor #medical #nurse #medicine #health #healthcare #doctors #medicina #coronavirus #surgery #nurselife  #nursing #surgeon #nurses #medstudent  #enfermagem  #medicalstudent #corona #healthcareworkers #besthospital #besthospitalinpatna  https://t.co/R7MSf9XtDl,Consult Today itself ,"['#hospital', '#covid', '#doctor', '#medical', '#nurse', '#medicine', '#health', '#healthcare', '#doctors', '#medicina', '#coronavirus', '#surgery', '#nurselife', '#nursing', '#surgeon', '#nurses', '#medstudent', '#enfermagem', '#medicalstudent', '#corona', '#healthcareworkers', '#besthospital', '#besthospitalinpatna']",[],['https://t.co/R7MSf9XtDl'],[]
"We can use this project to sanitize the coronavirus.  If there is a fire, you can use it to extinguish the fire. This is a Working mobel  https://t.co/uRIjo9Yakz",We can use this project to sanitize the coronavirus If there is a fire you can use it to extinguish the fire This is a Working mobel ,[],[],['https://t.co/uRIjo9Yakz'],[]
"International News: New Johnson &amp; Johnson Vaccine Starts Shipping Acro...  https://t.co/vDAT0f2If7, shipping began for Johnson &amp; Johnson’s new single-dose coronavirus vaccine, making a total of three vaccines now available.",International News: New Johnson amp Johnson Vaccine Starts Shipping Acro  shipping began for Johnson amp Johnson’s new singledose coronavirus vaccine making a total of three vaccines now available,[],[],"['https://t.co/vDAT0f2If7,']",[]
"The deadlier virus than corona virus is the human moron virus. You find them lurking around social media, infecting people with potent doses of misinformation! Symptoms: 0 facts, no data &amp; evidence, no sources, only biases &amp; misplaced nationalism. Oops missed verbal diarrhoea!",The deadlier virus than corona virus is the human moron virus You find them lurking around social media infecting people with potent doses of misinformation Symptoms: 0 facts no data amp evidence no sources only biases amp misplaced nationalism Oops missed verbal diarrhoea,[],[],[],[]
Corona Vaccine taken by Top Indian Politicians today .  #indianpolitician #india #corona #covi̇d19 #coronaupdates #coronapositive #coronavirus #coronavaccine  https://t.co/uJnGgiPRGT,Corona Vaccine taken by Top Indian Politicians today  ,"['#indianpolitician', '#india', '#corona', '#covi̇d19', '#coronaupdates', '#coronapositive', '#coronavirus', '#coronavaccine']",[],['https://t.co/uJnGgiPRGT'],[]
Coronavirus doctor's diary: Study shows one-in-three children have rarely been leaving the house  https://t.co/GeAjnLZiaC,Coronavirus doctors diary: Study shows oneinthree children have rarely been leaving the house ,[],[],['https://t.co/GeAjnLZiaC'],[]
HAPPIEST BIRTHDAY TO ONE OF THE MOST FINEST AND BRILLIANT CRICKETER OF PAKISTAN @SAfridiOfficial 🇵🇰 THANK YOU FOR CREATING THE SPIRIT OF CRICKET AMONG US! ♥️  #ShahidAfridi #HBDShahidAfridi #Cricket #MatchDikhao #Pakistan #PSL2021 #GoldenGlobes #China #coronavirus #mondaythoughts  https://t.co/uwUWGdS619,HAPPIEST BIRTHDAY TO ONE OF THE MOST FINEST AND BRILLIANT CRICKETER OF PAKISTAN  THANK YOU FOR CREATING THE SPIRIT OF CRICKET AMONG US  ,"['#ShahidAfridi', '#HBDShahidAfridi', '#Cricket', '#MatchDikhao', '#Pakistan', '#PSL2021', '#GoldenGlobes', '#China', '#coronavirus', '#mondaythoughts']",['@SAfridiOfficial'],['https://t.co/uwUWGdS619'],"['🇵🇰', '♥️']"
"JK reports 63 new positive cases, 123717 recovered so far  #JAMMU: The Government on Monday informed that 63 new positive cases of novel Corona virus (COVID-19), 09from Jammu division and 54 from Kashmir division.  https://t.co/kgK0wM6kF7",JK reports 63 new positive cases 123717 recovered so far The Government on Monday informed that 63 new positive cases of novel Corona virus (COVID19) 09from Jammu division and 54 from Kashmir division ,['#JAMMU:'],[],['https://t.co/kgK0wM6kF7'],[]
"@SabithaindraTRS Respected to the Honerable educational minister of Telangana. As iam Venkateshnayak of Bachelor of physiotherapy student 1st Year from KNRUHS-University(From Paramedical). Due to pandamic situation of Corona virus(Bsc-MLT and Bsc-Nursing) Courses Promoted,but", Respected to the Honerable educational minister of Telangana As iam Venkateshnayak of Bachelor of physiotherapy student 1st Year from KNRUHSUniversity(From Paramedical) Due to pandamic situation of Corona virus(BscMLT and BscNursing) Courses Promotedbut,[],['@SabithaindraTRS'],[],[]
A little girl makeover special speech of #coronavirus  https://t.co/lIGhCqszL8,A little girl makeover special speech of ,['#coronavirus'],[],['https://t.co/lIGhCqszL8'],[]
"Route recommendation        Departure Airport: ZGGG       Landing Airport: VTBS        Recommended model: Boeing 777 F.  Event: Vaccine Incident in Thailand  Remarks: On February 27, 2021, Thailand imported the first batch of coronavirus vaccine from China. @rortos  https://t.co/D1ZUAxw00R",Route recommendation Departure Airport: ZGGG Landing Airport: VTBS Recommended model: Boeing 777 F Event: Vaccine Incident in Thailand Remarks: On February 27 2021 Thailand imported the first batch of coronavirus vaccine from China ,[],['@rortos'],['https://t.co/D1ZUAxw00R'],[]
She is #COURAGEOUS. She returns to play and uses risk mitigation strategies to protect herself and her team mates. She uses her voice to encourage others to follow the guidelines as well. #WhoIsShe?    #BeTheChange #SeedTheChange #BeAWarrior #YodhaBanau #Covid19 #CoronaVirus  https://t.co/wCpnfa1gih,She is She returns to play and uses risk mitigation strategies to protect herself and her team mates She uses her voice to encourage others to follow the guidelines as well ,"['#COURAGEOUS.', '#WhoIsShe?', '#BeTheChange', '#SeedTheChange', '#BeAWarrior', '#YodhaBanau', '#Covid19', '#CoronaVirus']",[],['https://t.co/wCpnfa1gih'],[]
