id,conversation_id,created_at,date,time,timezone,user_id,username,name,place,tweet,language,mentions,urls,photos,replies_count,retweets_count,likes_count,hashtags,cashtags,link,retweet,quote_url,video,thumbnail,near,geo,source,user_rt_id,user_rt,retweet_id,reply_to,retweet_date,translate,trans_src,trans_dest
1429719911195189248,1429719911195189248,2021-08-23 13:49:24 India Standard Time,2021-08-23,13:49:24,+0530,336479899,axelency,Axel 🇮🇳,,"My prediction is that the curfew will end on Chaturti. By end I mean, open casinos and relax entry norms.   2 things come out of this;  1. Public will think twice before demanding a lockdown in the 3rd wave. 2. The govt. looks good for opening up the State on an auspicious day.",en,[],[],[],0,0,0,[],[],https://twitter.com/axelency/status/1429719911195189248,False,https://twitter.com/prudentgoa/status/1429419578568806401,0,,India,,,,,,[],,,,
1429689165713592321,1429689165713592321,2021-08-23 11:47:14 India Standard Time,2021-08-23,11:47:14,+0530,847145590341328897,guideindiatour,Guide India Tour,,"The Goa govt has extended curfew till 30th August.  River cruises, Spas, Casinos, auditoriums, community halls, water parks, entertainment parks will remain closed.  Cinema halls are allowed to functions with 50% capacity.  #Goa #IncredibleIndia #DekhoApnaDesh #GuideIndiaTour  https://t.co/4rB1xs5fq1",en,[],[],['https://pbs.twimg.com/media/E9dGsZdVUAAP87W.jpg'],0,0,2,"['goa', 'incredibleindia', 'dekhoapnadesh', 'guideindiatour']",[],https://twitter.com/Guideindiatour/status/1429689165713592321,False,,1,https://pbs.twimg.com/media/E9dGsZdVUAAP87W.jpg,India,,,,,,[],,,,
1429660561495650313,1429660561495650313,2021-08-23 09:53:34 India Standard Time,2021-08-23,09:53:34,+0530,1224024822239252480,pruthvisubbaiah,pruthvisubbaiah,,@DCKodagu @KodaguSp @CMofKarnataka @ravimlapa weekend curfew is only for kodagu people is it? May I know what does weekend curfew mean? Surprised to see the amount of tourist roaming in kodagu this weekend.  https://t.co/7lilO9fcbv,en,"[{'screen_name': 'kodagusp', 'name': 'sp kodagu', 'id': '1249562650570149888'}, {'screen_name': 'cmofkarnataka', 'name': 'cm of karnataka', 'id': '2713703797'}, {'screen_name': 'ravimlapa', 'name': 'appachu ranjan mla', 'id': '827387011384303621'}]",[],['https://pbs.twimg.com/media/E9cssJRVEAEAVQ1.jpg'],1,1,1,[],[],https://twitter.com/pruthvisubbaiah/status/1429660561495650313,False,,1,https://pbs.twimg.com/media/E9cssJRVEAEAVQ1.jpg,India,,,,,,[],,,,
1429509679990796288,1429509679990796288,2021-08-22 23:54:01 India Standard Time,2021-08-22,23:54:01,+0530,59524043,amlyatri,Ankur,,"Curfew extension is  freaking joke. It's unbelievable, the drama which is being made in the name of curfew.",en,[],[],[],0,0,8,[],[],https://twitter.com/amlyatri/status/1429509679990796288,False,,0,,India,,,,,,[],,,,
1429459347168382980,1429459347168382980,2021-08-22 20:34:01 India Standard Time,2021-08-22,20:34:01,+0530,973463760,mnazreen97,Yeng,,Teringat lak dulu pernah tulis nama kat pondok pb sebab masuk lambat lepas curfew. Pastu nama yang aku tulis tu “iskandar zulkarnain” wkwkwk,in,[],[],[],1,0,1,[],[],https://twitter.com/mnazreen97/status/1429459347168382980,False,,0,,India,,,,,,[],,,,
1429295288749989889,1429295288749989889,2021-08-22 09:42:06 India Standard Time,2021-08-22,09:42:06,+0530,3017951803,chungakabasil,Kuching observer,,The only good thing about tomorrow's  curfew is no traffic noise! Ear piercing noise from modified motorbikes is the worst in the Kuching city area!  https://t.co/pMfb8Ei5Y6,en,[],[],['https://pbs.twimg.com/tweet_video_thumb/E9Xge2rVEAQ7bAR.jpg'],0,0,0,[],[],https://twitter.com/chungakabasil/status/1429295288749989889,False,,1,https://pbs.twimg.com/tweet_video_thumb/E9Xge2rVEAQ7bAR.jpg,India,,,,,,[],,,,
1429174984660983812,1429174984660983812,2021-08-22 01:44:03 India Standard Time,2021-08-22,01:44:03,+0530,293424894,mak_asif,Asif Khan,,- Sri Lanka Army Commander General Shavendra Silva warned people not to misuse the 10-day quarantine curfew  and to remain at home as health workers and authorities rushed against time to stop a further spread of the contagious Delta variant. Only essential services are allowed!,en,[],[],[],1,3,73,[],[],https://twitter.com/mak_asif/status/1429174984660983812,False,,0,,India,,,,,,[],,,,
1429027723209416705,1429027723209416705,2021-08-21 15:58:53 India Standard Time,2021-08-21,15:58:53,+0530,1397888775657771009,pulasthiabe,Pula,,Got out of the house after a while believe it or not government impose island wide curfew very next evening. #lockdown #COVID19 #LK  https://t.co/oHAhL55ZJ2,en,[],[],['https://pbs.twimg.com/media/E9TtHvSXsAQ4PTF.jpg'],1,0,15,"['lockdown', 'covid19', 'lk']",[],https://twitter.com/pulasthiabe/status/1429027723209416705,False,,1,https://pbs.twimg.com/media/E9TtHvSXsAQ4PTF.jpg,India,,,,,,[],,,,
1428979026048204805,1428721128940490758,2021-08-21 12:45:23 India Standard Time,2021-08-21,12:45:23,+0530,1363086671554564097,abdulhamidmemo7,Abdul Hamid Memon,,"@ImranRiazKhan All guns from European countries &amp; USA on fire for Taliban,still to form  https://t.co/NKYZADREjX one talks or show sympathy for Kashmir Muslims, in curfew for year &amp;  https://t.co/PQU7x315ly this bcz India Stratigical Partner.Who made mess in Afghanistan? Isn't double standard?",en,[],"['http://government.No', 'http://more.Is']",[],0,0,0,[],[],https://twitter.com/AbdulHamidMemo7/status/1428979026048204805,False,,0,,India,,,,,,"[{'screen_name': 'ImranRiazKhan', 'name': 'Imran Khan', 'id': '1454557225'}]",,,,
1428945245740232709,1428945245740232709,2021-08-21 10:31:09 India Standard Time,2021-08-21,10:31:09,+0530,545154770,nirushanth07,Nirushanth Vasanthakumar,,It seems lockdown and curfew are the part of life,en,[],[],[],0,0,1,[],[],https://twitter.com/Nirushanth07/status/1428945245740232709,False,https://twitter.com/Dailymirror_SL/status/1428943877507928064,0,,India,,,,,,[],,,,
1428944886623993856,1428944886623993856,2021-08-21 10:29:44 India Standard Time,2021-08-21,10:29:44,+0530,41786801,srilankatweet,Sri Lanka Tweet 🇱🇰 💉,,Selected branches of all licensed banks in the Island will be kept open for Public during the quarantine curfew period - Hiru #LKA #SriLanka #lockdownsl,en,[],[],[],2,9,44,"['lka', 'srilanka', 'lockdownsl']",[],https://twitter.com/SriLankaTweet/status/1428944886623993856,False,https://twitter.com/SriLankaTweet/status/1428725365195755525,0,,India,,,,,,[],,,,
1428928009604501504,1428928009604501504,2021-08-21 09:22:40 India Standard Time,2021-08-21,09:22:40,+0530,82032058,svcs2021,SVCS,,#Covid19 Restrictions - Night Curfew has been extended till 4th Sep 2021 (11 pm to 6 am) in #AndhraPradesh. #COVID19Vaccine #WearAMask #WashYourHands #APFightsCorona #CoronaVaccine #VizagFightsCorona #IndiaFightsCorona #LargestVaccinationDrive #Visakhapatnam #Vizag  https://t.co/TTxhbZphmo,en,[],[],['https://pbs.twimg.com/media/E9SSc7BVgAURh0s.jpg'],0,0,1,"['covid19', 'andhrapradesh', 'covid19vaccine', 'wearamask', 'washyourhands', 'apfightscorona', 'coronavaccine', 'vizagfightscorona', 'indiafightscorona', 'largestvaccinationdrive', 'visakhapatnam', 'vizag']",[],https://twitter.com/svcs2021/status/1428928009604501504,False,,1,https://pbs.twimg.com/media/E9SSc7BVgAURh0s.jpg,India,,,,,,[],,,,
1428910829685010439,1428910829685010439,2021-08-21 08:14:24 India Standard Time,2021-08-21,08:14:24,+0530,1394478374622433284,mynight6_,🌻 MyNight - Blu's Struggles,,"HCMC preparing to go on full lockdown, bringing in 10,000 troops to secure the city..... Curfew still in effect, all shops, stores and warehouse closed or under military control.  #covid #lockdown #lockdownextension #saigon #Vietnam  https://t.co/U35W6ok0UP",en,[],[],"['https://pbs.twimg.com/media/E9SCzi3VUAAgBmh.jpg', 'https://pbs.twimg.com/media/E9SC0BVVgAcc9iR.jpg', 'https://pbs.twimg.com/media/E9SC0UZVgAIaA7t.jpg', 'https://pbs.twimg.com/media/E9SC02zVgAEs4E4.jpg']",1,4,1,"['covid', 'lockdown', 'lockdownextension', 'saigon', 'vietnam']",[],https://twitter.com/mynight6_/status/1428910829685010439,False,,1,https://pbs.twimg.com/media/E9SCzi3VUAAgBmh.jpg,India,,,,,,[],,,,
1428820182957314057,1428820182957314057,2021-08-21 02:14:12 India Standard Time,2021-08-21,02:14:12,+0530,830471414,ushanderonin,Ushan.,,"Can’t wait to get my hands on my copy. I was supposed to receive it by Tuesday, but now with the whole curfew situation, guess it’ll be a bit more late. Oh well. I know the wait is so worth it. ❤️ @SuckerPunchProd  https://t.co/WGtvMu1OYe",en,"[{'screen_name': 'suckerpunchprod', 'name': ""ghost of tsushima 🎮 director's cut out now!"", 'id': '23843220'}]",[],['https://pbs.twimg.com/media/E9QwYOWVgAIpegb.jpg'],0,0,2,[],[],https://twitter.com/UshanDeRonin/status/1428820182957314057,False,,1,https://pbs.twimg.com/media/E9QwYOWVgAIpegb.jpg,India,,,,,,[],,,,
1428776976064532482,1428776976064532482,2021-08-20 23:22:31 India Standard Time,2021-08-20,23:22:31,+0530,1001015097404284928,vizaglocalwire,Vizag Localwire,,Night Curfew new Timings in Andhra Pradesh.  #NightCurfew #AndhraPradesh #Visakhapatnam #Vizag #Localwire #LocalwireApp  https://t.co/G3h4rQjZGW,en,[],[],['https://pbs.twimg.com/media/E9QJFmSUUAMm10N.jpg'],0,1,5,"['nightcurfew', 'andhrapradesh', 'visakhapatnam', 'vizag', 'localwire', 'localwireapp']",[],https://twitter.com/vizaglocalwire/status/1428776976064532482,False,,1,https://pbs.twimg.com/media/E9QJFmSUUAMm10N.jpg,India,,,,,,[],,,,
1428773479743037696,1428773479743037696,2021-08-20 23:08:37 India Standard Time,2021-08-20,23:08:37,+0530,41786801,srilankatweet,Sri Lanka Tweet 🇱🇰 💉,,All covid vaccination programs and vaccination centers will be in operational as usual including vaccination of over 60 years of age population during the quarantine curfew period: Army Commander #LKA #SriLanka #vaccinated,en,[],[],[],1,10,38,"['lka', 'srilanka', 'vaccinated']",[],https://twitter.com/SriLankaTweet/status/1428773479743037696,False,https://twitter.com/SriLankaTweet/status/1428725365195755525,0,,India,,,,,,[],,,,
1428766210737545224,1428766210737545224,2021-08-20 22:39:44 India Standard Time,2021-08-20,22:39:44,+0530,26944786,joeynikejo,Joey Nike Jo,"{'type': 'Point', 'coordinates': [24.50450683, 54.40724281]}","Of mangroves and city lights. Finally, no more 12am to 5am curfew. 🥳🥳  Not that I am going anywhere anyway. 😄😄 @ Reem Central Park  https://t.co/HOfHJXLclJ",en,[],['https://www.instagram.com/p/CSzdgacp9Ay/?utm_medium=twitter'],[],0,0,0,[],[],https://twitter.com/joeynikejo/status/1428766210737545224,False,,0,,India,,,,,,[],,,,
1428727418903154690,1428727418903154690,2021-08-20 20:05:35 India Standard Time,2021-08-20,20:05:35,+0530,791722824,varnasuthan1104,Varnasuthan,,The historical kandy Esala Perahera this year will continue without spectators in spite of the quarantine curfew  #lockdown #COVID19 #SriLanka #kandy #coronavirus #COVID19Vaccine,en,[],[],[],0,0,0,"['lockdown', 'covid19', 'srilanka', 'kandy', 'coronavirus', 'covid19vaccine']",[],https://twitter.com/varnasuthan1104/status/1428727418903154690,False,,0,,India,,,,,,[],,,,
1428725365195755525,1428725365195755525,2021-08-20 19:57:26 India Standard Time,2021-08-20,19:57:26,+0530,41786801,srilankatweet,Sri Lanka Tweet 🇱🇰 💉,,Colombo Stock Exchange CSE trading will take place as usual  during the quarantine curfew period: @CSE_Media #LKA #SriLanka #lockdownsl,en,"[{'screen_name': 'cse_media', 'name': 'colombo stock exchange', 'id': '2242256395'}]",[],[],0,8,48,"['lka', 'srilanka', 'lockdownsl']",[],https://twitter.com/SriLankaTweet/status/1428725365195755525,False,https://twitter.com/SriLankaTweet/status/1428699585262678016,0,,India,,,,,,[],,,,
1428709794815242241,1428388007950880777,2021-08-20 18:55:33 India Standard Time,2021-08-20,18:55:33,+0530,273134568,omegaincyber,🌱👽 👩🏽‍💻🏴‍☠️,,@kvthy_ @robyncousn @EROD2481 @JLaCocaina I’m not in public. We are under lockdown and curfew. People are dying in the streets and being picked up later. Seeing that American are doing this they should be banned from international travel,en,[],[],[],1,0,0,[],[],https://twitter.com/OmegaInCyber/status/1428709794815242241,False,,0,,India,,,,,,"[{'screen_name': 'kvthy_', 'name': 'Kathy', 'id': '145054139'}, {'screen_name': 'robyncousn', 'name': 'Are you new here?', 'id': '1283142470533095426'}, {'screen_name': 'JLaCocaina', 'name': 'Good Hands.', 'id': '43659921'}]",,,,
1428708788262088705,1428664871797751812,2021-08-20 18:51:33 India Standard Time,2021-08-20,18:51:33,+0530,213306799,erangatennakoon,eranga tennakoon,,@wasaba During curfew also essential works can operate. Lockdown is also the same.,en,[],[],[],0,0,0,[],[],https://twitter.com/erangatennakoon/status/1428708788262088705,False,,0,,India,,,,,,"[{'screen_name': 'wasaba', 'name': 'WB', 'id': '553305589'}]",,,,
1428706540479942664,1428706540479942664,2021-08-20 18:42:37 India Standard Time,2021-08-20,18:42:37,+0530,41173825,samsperspective,Sameer Yoonus,,"#DialogSLCT20 League will be played as scheduled on 21st, 22nd &amp; 24th August in Pallekelle despite the Quarantine Curfew in the country. @ThePapareSports has got at least the 1st few days of your lockdown covered. Join us at 2.20pm tomorrow!",en,"[{'screen_name': 'thepaparesports', 'name': 'thepapare.com', 'id': '241102823'}]",[],[],2,1,22,['dialogslct20'],[],https://twitter.com/samsperspective/status/1428706540479942664,False,,0,,India,,,,,,[],,,,
1428699585262678016,1428699585262678016,2021-08-20 18:14:59 India Standard Time,2021-08-20,18:14:59,+0530,41786801,srilankatweet,Sri Lanka Tweet 🇱🇰 💉,,Construction work of roads and highways Islandwide will continue as usual despite the quarantine curfew : Minister Johnston Fernando / Newsfirst #LKA #SriLanka #lockdownsl,en,[],[],[],1,5,38,"['lka', 'srilanka', 'lockdownsl']",[],https://twitter.com/SriLankaTweet/status/1428699585262678016,False,https://twitter.com/SriLankaTweet/status/1428699269448364053,0,,India,,,,,,[],,,,
1428699269448364053,1428699269448364053,2021-08-20 18:13:44 India Standard Time,2021-08-20,18:13:44,+0530,41786801,srilankatweet,Sri Lanka Tweet 🇱🇰 💉,,All export sector &amp; apparel factories allowed to function as usual during quarantine curfew period - Army Commander- Adaderana #LKA #SriLanka #lockdownsl,en,[],[],[],1,13,37,"['lka', 'srilanka', 'lockdownsl']",[],https://twitter.com/SriLankaTweet/status/1428699269448364053,False,https://twitter.com/SriLankaTweet/status/1428654062182928385,0,,India,,,,,,[],,,,
1428661110240997378,1428661110240997378,2021-08-20 15:42:06 India Standard Time,2021-08-20,15:42:06,+0530,3017951803,chungakabasil,Kuching observer,,Kuching southern zone back to curfew this Monday and dine in prohibited...  https://t.co/RWTyxy76ek,en,[],[],['https://pbs.twimg.com/media/E9OftUqUYAQSrwD.jpg'],0,0,0,[],[],https://twitter.com/chungakabasil/status/1428661110240997378,False,,1,https://pbs.twimg.com/media/E9OftUqUYAQSrwD.jpg,India,,,,,,[],,,,
1428654062182928385,1428654062182928385,2021-08-20 15:14:06 India Standard Time,2021-08-20,15:14:06,+0530,41786801,srilankatweet,Sri Lanka Tweet 🇱🇰 💉,,"Quarantine Curfew from today 10pm till 30th August 4 am. Essential services, Apparel sector, Agriculture &amp; pharmacies will kept open. Vaccination program of over 60 years of age will continue. Army Commander  https://t.co/NTGxxz933h #LKA #SriLanka #COVID19SL  https://t.co/3VFAQaxNrP",en,[],['https://www.lankaxpress.com/sri-lanka-government-considering-a-lockdown/'],[],10,49,115,"['lka', 'srilanka', 'covid19sl']",[],https://twitter.com/SriLankaTweet/status/1428654062182928385,False,,1,https://pbs.twimg.com/ext_tw_video_thumb/1428653777041575936/pu/img/OnlvHvrjCIJyDhXI.jpg,India,,,,,,[],,,,
1428648887015776256,1428648887015776256,2021-08-20 14:53:32 India Standard Time,2021-08-20,14:53:32,+0530,1638288337,wikiayiyaa,Wiki Wikramarathna,,"#BREAKING NEWS JUST IN  10 DAY QUARANTINE CURFEW IMPOSED FROM 10 PM TONIGHT THE 20TH AUG TILL 30TH AUG 4 AM.  PHARMACIES, GARMENT FACTORIES OPEN-Wiki Wiks-'21-08-20 #SriLanka #Curfew  https://t.co/4LcpEpbHWq",en,[],[],[],0,0,0,"['breaking', 'srilanka', 'curfew']",[],https://twitter.com/Wikiayiyaa/status/1428648887015776256,False,,1,https://pbs.twimg.com/ext_tw_video_thumb/1428648702478979080/pu/img/id3CDtE6PCjWRF8t.jpg,India,,,,,,[],,,,
1428645970594521089,1428645970594521089,2021-08-20 14:41:57 India Standard Time,2021-08-20,14:41:57,+0530,112316395,gishwi,Gishan Wijesundera,,Curfew will be imposed in the country from 10 pm today (20) until 4 am on Monday (30) #lka,en,[],[],[],1,0,1,['lka'],[],https://twitter.com/gishwi/status/1428645970594521089,False,,0,,India,,,,,,[],,,,
1428645299367514112,1428645299367514112,2021-08-20 14:39:16 India Standard Time,2021-08-20,14:39:16,+0530,1310945286659997697,drewinseasia,Drew,,ill belive there is a curfew when the eastern suburbs has a curfew till then its a political pleaser #auspol,en,[],[],[],0,0,1,['auspol'],[],https://twitter.com/DrewInSeAsia/status/1428645299367514112,False,https://twitter.com/sophie_nomad/status/1428633360889311232,0,,India,,,,,,[],,,,
1428643914592886791,1428643914592886791,2021-08-20 14:33:46 India Standard Time,2021-08-20,14:33:46,+0530,1314924752629239809,lui_viet,Tuấn Kiệt (they/them),,The latest reports say that the government with the assistance of the military will take over super markets and food wholesalers to distribute food to the people during the 24/7 curfew.  Panic buying has already emptied all the shops near me.,en,[],[],[],0,0,1,[],[],https://twitter.com/lui_viet/status/1428643914592886791,False,,0,,India,,,,,,[],,,,
1428578226658439177,1428578226658439177,2021-08-20 10:12:45 India Standard Time,2021-08-20,10:12:45,+0530,1314924752629239809,lui_viet,Tuấn Kiệt (they/them),,"Yesterday's rumors were right: 24/7 curfew from Aug 23 on.  So far, we had just lockdown, strict social distancing &amp; a curfew from 6PM - 6AM. Also roadblocks, checkpoints between districts and a lot of patrols.  But people were still allowed to go out for buying food or medicine.",en,[],[],[],0,0,1,[],[],https://twitter.com/lui_viet/status/1428578226658439177,False,,0,,India,,,,,,[],,,,
1428571280819646475,1428401040181710850,2021-08-20 09:45:09 India Standard Time,2021-08-20,09:45:09,+0530,33883857,shirazlatiff,Shiraz Latiff,,@Jamz5251 Flouted curfew 😂?,en,[],[],[],0,0,0,[],[],https://twitter.com/Shirazlatiff/status/1428571280819646475,False,,0,,India,,,,,,"[{'screen_name': 'Jamz5251', 'name': 'Jamila Husain', 'id': '1136848920'}]",,,,
1428528940625195013,1428528940625195013,2021-08-20 06:56:54 India Standard Time,2021-08-20,06:56:54,+0530,1314924752629239809,lui_viet,Tuấn Kiệt (they/them),,"It took me a while to fill out and submit the proper forms to request election documents. Because of lockdown and curfew and stuff.  But it's done.  Time for waiting. Based on my experience, it can take weeks for the documents, and it's a gamble that it will get to the recipient.",en,[],[],[],0,0,0,[],[],https://twitter.com/lui_viet/status/1428528940625195013,False,,0,,India,,,,,,[],,,,
1431321772377317376,1429018904907550722,2021-08-27 23:54:37 India Standard Time,2021-08-27,23:54:37,+0530,511679739,maheshmanglam,Mahesh Limbachiya,,@HitJasoliya @CP_SuratCity @GujaratPolice @dgpgujarat @cyber @CybercrimeCID Hitesh Bhai no entry ni pari bhasa janavso? Sarkar no curfew kya sudhi Che. Aa police Jo kadak Thai to સૌ વધુ t varacha ane katargam ma loko heran Thai. ગામડે થી આવતી અને જતી બસ 75%સોસાયટી ના નાકે થી પિક ઉપ અને ડ્રોપ કરે છે..બસ નો ફોટો મૂક્યો એટલે કીધું. સરકારી બસ કયું વાહન કેવાય,und,[],[],[],1,0,0,[],[],https://twitter.com/MaheshManglam/status/1431321772377317376,False,,0,,India,,,,,,"[{'screen_name': 'HitJasoliya', 'name': 'Hitesh Jasoliya  मैं भी सैनिक', 'id': '922158621030576128'}, {'screen_name': 'CP_SuratCity', 'name': 'Surat City Police', 'id': '713285748393259008'}, {'screen_name': 'GujaratPolice', 'name': 'Gujarat  Police', 'id': '805702426338545664'}, {'screen_name': 'dgpgujarat', 'name': 'DGP Gujarat', 'id': '953531755138437120'}, {'screen_name': 'cyber', 'name': 'Cybersecurity', 'id': '481439919'}, {'screen_name': 'CybercrimeCID', 'name': 'Cybercrime CID', 'id': '4742953524'}]",,,,
1431300566706110464,1431149873340899330,2021-08-27 22:30:22 India Standard Time,2021-08-27,22:30:22,+0530,140768488,nihalapura,Rajarata Raja,,"@Adele_Srilanka Even in the curfew lockdown period, we have to work. But I enjoy every minute of life",en,[],[],[],1,0,1,[],[],https://twitter.com/nihalapura/status/1431300566706110464,False,,0,,India,,,,,,"[{'screen_name': 'Adele_Srilanka', 'name': 'ADELE SRILANKAN PAGE (ඇඩෙල්ගේ ලාංකීය පිටුව )', 'id': '704012037697855489'}]",,,,
1431292098288881669,1431292098288881669,2021-08-27 21:56:43 India Standard Time,2021-08-27,21:56:43,+0530,522343425,urmila92531581,Urmila Chanam,,#Community fronline volunteers' biggest hindrance is operating during lockdown/curfew whereby going out to buy-deliver medicines or essential supplies has exposed them to police harassment or confrontation with curfew imposers #Covid19India #Imphal #Manipur #northeastindia,en,[],[],[],0,0,1,"['community', 'covid19india', 'imphal', 'manipur', 'northeastindia']",[],https://twitter.com/Urmila92531581/status/1431292098288881669,False,,0,,India,,,,,,[],,,,
1431268300592271360,1431268300592271360,2021-08-27 20:22:09 India Standard Time,2021-08-27,20:22:09,+0530,1387625346921467910,jayanta13998620,Jayanta Chatterjee,,Sri Lanka extends curfew as Covid-19 toll hits new record  https://t.co/bzQp1lJ5F9,en,[],['https://newswav.com/A2108_vZKVc2?s=A_O2FvaJf'],[],0,0,0,[],[],https://twitter.com/Jayanta13998620/status/1431268300592271360,False,,0,,India,,,,,,[],,,,
1431245403412779011,1431234559530573824,2021-08-27 18:51:10 India Standard Time,2021-08-27,18:51:10,+0530,361925762,vinodharwarkar,Howdyvinny,,@shankar15298001 @allaboutbelgaum Dont understand why you want curfew... Its not a solution,en,[],[],[],0,0,0,[],[],https://twitter.com/vinodharwarkar/status/1431245403412779011,False,,0,,India,,,,,,"[{'screen_name': 'shankar15298001', 'name': 'shankar rao', 'id': '1391618911951491075'}, {'screen_name': 'allaboutbelgaum', 'name': 'All About Belgaum', 'id': '15126071'}]",,,,
1431228801514569733,1431228801514569733,2021-08-27 17:45:11 India Standard Time,2021-08-27,17:45:11,+0530,310069117,studio2702,JIRAYUTH Y.,,ฉันก็เป็นหนึ่งในผู้ประสบภัย curfew 🥲 …,th,[],[],[],0,0,3,[],[],https://twitter.com/studio2702/status/1431228801514569733,False,https://twitter.com/nuttoday/status/1431161325468598276,0,,India,,,,,,[],,,,
1431177888577961984,1431177888577961984,2021-08-27 14:22:53 India Standard Time,2021-08-27,14:22:53,+0530,2664632184,iamhimanshi0304,Sanjuka Karunathilaka,,Lockdown extended❗  The prevailing Qurantine Curfew will further EXTENDED until 4am on September 06: Minister of Health Keheliya Rambukwella #LKA #SriLanka #COVID19SL #lockdownsl,en,[],[],[],0,0,0,"['lka', 'srilanka', 'covid19sl', 'lockdownsl']",[],https://twitter.com/iamhimanshi0304/status/1431177888577961984,False,,0,,India,,,,,,[],,,,
1431169837728813060,1431158970782085120,2021-08-27 13:50:53 India Standard Time,2021-08-27,13:50:53,+0530,1164578240310194176,ameshkavisha,Amesh Kavisha,,@Keheliya_R Dear Sir plz close the all the Garments &amp; Other not important Coparate Companies this is not Right curfew peoples are walking every were plz take immediate action about this,en,[],[],[],1,0,0,[],[],https://twitter.com/AmeshKavisha/status/1431169837728813060,False,,0,,India,,,,,,"[{'screen_name': 'Keheliya_R', 'name': 'Keheliya Rambukwella', 'id': '3187497308'}]",,,,
1431168193641418755,1431168193641418755,2021-08-27 13:44:21 India Standard Time,2021-08-27,13:44:21,+0530,3323780899,sandro221b,Sandro Sathyajith ,,🔴 CURFEW EXTENDED  🔴 📌 The prevailing Qurantine Curfew further EXTENDED until 4am on September 06.  -  Minister of Health: @Keheliya_R #LKA #Lockdown #COVID19LK,en,"[{'screen_name': 'keheliya_r', 'name': 'keheliya rambukwella', 'id': '3187497308'}]",[],[],0,1,2,"['lka', 'lockdown', 'covid19lk']",[],https://twitter.com/sandro221b/status/1431168193641418755,False,,0,,India,,,,,,[],,,,
1431163463917703173,1431163463917703173,2021-08-27 13:25:34 India Standard Time,2021-08-27,13:25:34,+0530,791722824,varnasuthan1104,Varnasuthan,,The Islandwide quarantine curfew has been extended until 4 am on September 6-Presidential spokesman   #COVID19 #SriLanka #lockdown #lka,en,[],[],[],0,0,1,"['covid19', 'srilanka', 'lockdown', 'lka']",[],https://twitter.com/varnasuthan1104/status/1431163463917703173,False,,0,,India,,,,,,[],,,,
1431162605414981646,1431162605414981646,2021-08-27 13:22:09 India Standard Time,2021-08-27,13:22:09,+0530,196273737,danuinn,Danu Innasithamby,,The current quarantine curfew in force will be extended till 06th September - Minister Keheliya Rambukwella,en,[],[],[],0,0,3,[],[],https://twitter.com/Danuinn/status/1431162605414981646,False,,0,,India,,,,,,[],,,,
1431161258632310790,1431161258632310790,2021-08-27 13:16:48 India Standard Time,2021-08-27,13:16:48,+0530,112316395,gishwi,Gishan Wijesundera,,Curfew extended for another week #lka,en,[],[],[],0,0,0,['lka'],[],https://twitter.com/gishwi/status/1431161258632310790,False,,0,,India,,,,,,[],,,,
