id,conversation_id,created_at,date,time,timezone,user_id,username,name,place,tweet,language,mentions,urls,photos,replies_count,retweets_count,likes_count,hashtags,cashtags,link,retweet,quote_url,video,thumbnail,near,geo,source,user_rt_id,user_rt,retweet_id,reply_to,retweet_date,translate,trans_src,trans_dest
1.40088E+18,1.40088E+18,2021-06-05 00:07:26 India Standard Time,05-06-21,00:07:26,530,7.26655E+17,ranjan2506,Amit Ranjan,,@officecmbihar  If the mis - management of COVID is over @NitishKumar and running away from accountability towards #PeopleOfBihar is done then kindly @PiyushGoyalOffc provide Electricity 24 hours in patna @barandbench as RIGHT to ELECTRICITY is our basic necessity. @suchetadalal,en,"[{'screen_name': 'nitishkumar', 'name': 'nitish kumar', 'id': '143409075'}, {'screen_name': 'piyushgoyaloffc', 'name': 'piyush goyal office', 'id': '717686709983424513'}, {'screen_name': 'barandbench', 'name': 'bar & bench', 'id': '67577895'}, {'screen_name': 'suchetadalal', 'name': 'sucheta dalal', 'id': '41094453'}]",[],[],0,0,0,['peopleofbihar'],[],https://twitter.com/Ranjan2506/status/1400884416033955844,FALSE,,0,,India,,,,,,[],,,,
1.40088E+18,1.40088E+18,2021-06-05 00:03:57 India Standard Time,05-06-21,00:03:57,530,9.45691E+17,vasanmsv,Vasan MSV,,It is people’s money and should be spent for the people. Is Modi paying from his grand father’s pocket?  Another thug life moment by Dr PTR   Should Covid Vaccines Be Free For All? Tamil Nadu Finance Minister Palan...  https://t.co/nfPixf75ph via @YouTube,en,"[{'screen_name': 'youtube', 'name': 'youtube', 'id': '10228272'}]",['https://youtu.be/Htyzak53S-U'],[],0,1,1,[],[],https://twitter.com/VasanMSV/status/1400883537868333057,FALSE,,0,,India,,,,,,[],,,,
1.40088E+18,1.40088E+18,2021-06-05 00:02:41 India Standard Time,05-06-21,00:02:41,530,1.24382E+18,saradabhol,Sarada Prasanna Bhol,,"Dear Sir,  I request to you allow to all MLM sector to build their team and  business(as per covid norms) because this time is very cretical time for all people so that I think all types of problems can solved in this platform for people to grow their income&amp; National growth also",en,[],[],[],0,1,1,[],[],https://twitter.com/SaradaBhol/status/1400883221949140996,FALSE,,0,,India,,,,,,[],,,,
1.40088E+18,1.40066E+18,2021-06-05 00:02:34 India Standard Time,05-06-21,00:02:34,530,3095693396,sabg_98,SabG🗨️,,"@Kaushik05993531 @dmuthuk @itisprashanth Yow military, 33 lakhs ku ITC shares ah. I don't think it's going to rise. Heavy cash reserves. No reinvestment plan. Covid - hit hospitality &amp; stationery business. Invest in better growth stocks (HDFC Life, United Spirits,  Britannia, TCS, Asian Paints, Pidlite, Titan) 12% CAGR",en,[],[],[],1,0,2,[],[],https://twitter.com/sabg_98/status/1400883192693882882,FALSE,,0,,India,,,,,,"[{'screen_name': 'Kaushik05993531', 'name': 'Kaushik s', 'id': '1398897099547181056'}, {'screen_name': 'dmuthuk', 'name': 'D.Muthukrishnan', 'id': '375369317'}, {'screen_name': 'itisprashanth', 'name': 'Prashanth Rangaswamy', 'id': '59468437'}]",,,,
1.40088E+18,1.40088E+18,2021-06-04 23:59:15 India Standard Time,04-06-21,23:59:15,530,211547287,nadzwareina,Raden Azwani 🇲🇾 🇵🇸,,"One fine day when this Covid is over, i'm gonna repeat this trip and shout, 'Istanbul aku datang lagi!'  https://t.co/P0qRU7cRsD",en,[],[],['https://pbs.twimg.com/media/E3DvE7lVIAUq8sV.jpg'],0,3,7,[],[],https://twitter.com/nadzwareina/status/1400882354948767745,FALSE,https://twitter.com/Beto_Kusyairy/status/1400844184810971137,1,https://pbs.twimg.com/media/E3DvE7lVIAUq8sV.jpg,India,,,,,,[],,,,
1.40088E+18,1.40088E+18,2021-06-04 23:55:01 India Standard Time,04-06-21,23:55:01,530,7.59756E+17,tabrezkhansab92,Tabrez Khan Official,,"#Alhamdulillah 33rd day of @KhidmatEMillat team distribute food package to #COVID patients attenders in QP, Maridan L, Tipu Sultan, Mannur, GIMS, Turman Cc Hospital's Gulbarga under the leadership of @Wahaj_Baba.  #COVIDEmergencyIndia #SecondWaveofCovid  https://t.co/CUv1ZVnAmz",en,"[{'screen_name': 'khidmatemillat', 'name': 'majlis e khidmat e millat hyd & kar region', 'id': '1252552966613143552'}, {'screen_name': 'wahaj_baba', 'name': 'wahaj baba', 'id': '522065394'}]",[],"['https://pbs.twimg.com/media/E3DuFhhVkAABgHP.jpg', 'https://pbs.twimg.com/media/E3DuF33VoAQ_e2U.jpg', 'https://pbs.twimg.com/media/E3DuGQAUcAIi4K-.jpg', 'https://pbs.twimg.com/media/E3DuG8dVEAA40fp.jpg']",1,1,7,"['alhamdulillah', 'covid', 'covidemergencyindia', 'secondwaveofcovid']",[],https://twitter.com/TabrezKhanSab92/status/1400881291243917315,FALSE,,1,https://pbs.twimg.com/media/E3DuFhhVkAABgHP.jpg,India,,,,,,[],,,,
1.40169E+18,1.40169E+18,2021-06-07 05:22:58 India Standard Time,07-06-21,05:22:58,530,481815585,izullk,betul,,Kena covid 🤭,en,[],[],[],0,0,1,[],[],https://twitter.com/Izullk/status/1401688599414775810,FALSE,https://twitter.com/zarryhendrik/status/1401461500867354626,0,,India,,,,,,[],,,,
1.40169E+18,1.40169E+18,2021-06-07 05:18:25 India Standard Time,07-06-21,05:18:25,530,3243285595,imagestilista,Aditi Khanna,,"You are precious, so is everyone around you! We are in this together! Let's beat COVID! Let's get vaccinated!  #TTC #ttc #goodvibrations  #imageconsultants #softskillstraining #covid19 #vaccination #staysafe  https://t.co/WBaxiLgTc6",en,[],[],['https://pbs.twimg.com/media/E3PLTkHUYAAuZN3.jpg'],0,0,2,"['ttc', 'ttc', 'goodvibrations', 'imageconsultants', 'softskillstraining', 'covid19', 'vaccination', 'staysafe']",[],https://twitter.com/ImageStilista/status/1401687453644181504,FALSE,,1,https://pbs.twimg.com/media/E3PLTkHUYAAuZN3.jpg,India,,,,,,[],,,,
1.40169E+18,1.40169E+18,2021-06-07 05:17:10 India Standard Time,07-06-21,05:17:10,530,1079182483,ajiqcorn,Azie with 🇵🇸,,"Panic buying is a must actually sebab siapa sangka, tiba-tiba kang tutup sebab covid la, kena tutup sebab tak ikut SOP la, dipaksa tutup sebab Miti la dan bla bla bla. Penat jadi rakyat yang tiada kuasa dan duit rasuah.",in,[],[],[],0,0,0,[],[],https://twitter.com/ajiqcorn/status/1401687136265400321,FALSE,,0,,India,,,,,,[],,,,
1.40169E+18,1.4015E+18,2021-06-07 05:15:52 India Standard Time,07-06-21,05:15:52,530,1.09504E+18,afiqbruhh,"Hey, It's Afiq ",,@amarflexi92 Selagi mana ada yg tak nampak covid is real selagi tu ada yg selfish,in,[],[],[],1,0,1,[],[],https://twitter.com/AfiqBruhh/status/1401686812444160001,FALSE,,0,,India,,,,,,"[{'screen_name': 'amarflexi92', 'name': 'Amarflexi92', 'id': '1222066005888733184'}]",,,,
1.40169E+18,1.40169E+18,2021-06-07 05:12:01 India Standard Time,07-06-21,05:12:01,530,51466521,sbdanish,Danish Shaik,,"Because of fudged figures, orphans, families, etc. are not getting the aid they need to, as they were not considered #COVID19 #deaths in #India. Public should understand, when actual #covid deaths aren't reported, whatever aid you announce, that will not reach all those impacted.  https://t.co/gwifcbosVG",en,[],[],"['https://pbs.twimg.com/media/E3PJ1RfUUAEWF8v.jpg', 'https://pbs.twimg.com/media/E3PJ2DrUYAIt9_z.jpg']",0,0,2,"['covid19', 'deaths', 'india', 'covid']",[],https://twitter.com/sbdanish/status/1401685843069206530,FALSE,https://twitter.com/parthpunter/status/1401091668166647808,1,https://pbs.twimg.com/media/E3PJ1RfUUAEWF8v.jpg,India,,,,,,[],,,,
1.40169E+18,1.40169E+18,2021-06-07 05:11:54 India Standard Time,07-06-21,05:11:54,530,1.3255E+18,nextceomuda,Aldi Apriandi,,Jawa timur lagi naik kasus covid. Agak worry buat k sidoarjo sm bromo nic,in,[],[],[],0,0,0,[],[],https://twitter.com/NextCEOmuda/status/1401685813042188291,FALSE,,0,,India,,,,,,[],,,,
1.40168E+18,1.40168E+18,2021-06-07 04:51:03 India Standard Time,07-06-21,04:51:03,530,8.3655E+17,sipgrab,SipGrab,"{'type': 'Point', 'coordinates': [19.00117717, 72.9097582]}",Hundreds of former leaders urge G7 to vaccinate poor against COVID-19  https://t.co/tPNU4zgRvg #Sipgrab #UnitingPeopleWithThePossibilities,en,[],['http://dlvr.it/S1C3BX'],[],0,0,0,"['sipgrab', 'unitingpeoplewiththepossibilities']",[],https://twitter.com/sipgrab/status/1401680563723935749,FALSE,,0,,India,,,,,,[],,,,
1.40168E+18,1.40156E+18,2021-06-07 04:40:23 India Standard Time,07-06-21,04:40:23,530,1.26221E+18,pawan0bhardwaj,Pawan Bhardwaj,,"@HindWarrior2 @richapandey @ArvindKejriwal @msisodia @BJP4Delhi @adeshguptabjp @praveenskapoor @Rajan_Tewari @HarishKhuranna @GautamGambhir @Gupta_vijender @dushyanttgautam @hdmalhotra @kuljeetschahal @BJP4India @AmitShah Ye petition h c...bana raha h Sisodia Education k naam pe kya bola in covid Pendamic we helped jin k children r studied in private Schools we care about this , Schools don't take full fee only tution fee  Kya hua Inn AAP eo ki kahi chalti h  Medical m to dikh gya or Education",en,[],[],[],1,0,0,[],[],https://twitter.com/Pawan0Bhardwaj/status/1401677879327395841,FALSE,,0,,India,,,,,,"[{'screen_name': 'HindWarrior2', 'name': 'हिन्दWarrior 🇮🇳', 'id': '1299037096699498496'}, {'screen_name': 'richapandey', 'name': 'Richa Pandey Mishra', 'id': '16963786'}, {'screen_name': 'ArvindKejriwal', 'name': 'Arvind Kejriwal', 'id': '405427035'}, {'screen_name': 'msisodia', 'name': 'Manish Sisodia', 'id': '30417501'}, {'screen_name': 'BJP4Delhi', 'name': 'BJP Delhi', 'id': '337065278'}, {'screen_name': 'adeshguptabjp', 'name': 'Adesh Gupta', 'id': '804003606001106944'}, {'screen_name': 'praveenskapoor', 'name': 'Praveen Shankar Kapoor', 'id': '194193419'}, {'screen_name': 'Rajan_Tewari', 'name': 'Rajan Tewari', 'id': '116736740'}, {'screen_name': 'HarishKhuranna', 'name': 'Harish Khurana', 'id': '1722800118'}, {'screen_name': 'GautamGambhir', 'name': 'Gautam Gambhir', 'id': '99448420'}, {'screen_name': 'Gupta_vijender', 'name': 'Vijender Gupta', 'id': '1054143836'}, {'screen_name': 'dushyanttgautam', 'name': 'Dushyant Kumar Gautam', 'id': '2834868063'}, {'screen_name': 'hdmalhotra', 'name': 'Harshdeep Malhotra', 'id': '3192861932'}, {'screen_name': 'kuljeetschahal', 'name': 'Kuljeet Singh Chahal 🇮🇳', 'id': '3236480554'}, {'screen_name': 'BJP4India', 'name': 'BJP', 'id': '207809313'}, {'screen_name': 'AmitShah', 'name': 'Amit Shah', 'id': '1447949844'}]",,,,
1.40168E+18,1.40168E+18,2021-06-07 04:36:01 India Standard Time,07-06-21,04:36:01,530,832663878,mir_nrnmrh,نور عينا اميره 🇵🇸,,"Tapi dia tu ada 1 kes dulu, before covid lagi. Tengok post ig dia pon dah sense something wrong. Aku cakao naim, naim cakap dia fahaman apa tah, taksub sangat. Nak sekali pasal vaksin ni all out betul. Takut betul😂",in,[],[],[],0,0,0,[],[],https://twitter.com/mir_nrnmrh/status/1401676781816467458,FALSE,,0,,India,,,,,,[],,,,
1.40168E+18,1.40139E+18,2021-06-07 04:31:48 India Standard Time,07-06-21,04:31:48,530,4442653153,_nsir_,Nasir,,@ruthimanrique Otak tak stable laa mal. Kena press. Tak cukup tidur lagi. Rank lose  streak. Itu yang koyak tu 🤣 Kau kalau nak further degree nanti tunggu dah habis covid mal. Odl ni taik. Dia dengan moonton sama level 😌,in,[],[],[],0,0,0,[],[],https://twitter.com/_Nsir_/status/1401675721085308929,FALSE,,0,,India,,,,,,[],,,,
1.40167E+18,1.40167E+18,2021-06-07 04:01:03 India Standard Time,07-06-21,04:01:03,530,2284550540,andrew_stotz,Andrew “The Worst” Stotz,,"Good news of the day, 157,030,033 people worldwide have recovered from Covid-19.",en,[],[],[],1,0,2,[],[],https://twitter.com/Andrew_Stotz/status/1401667981948555265,FALSE,,0,,India,,,,,,[],,,,
1.40167E+18,1.40167E+18,2021-06-07 03:58:57 India Standard Time,07-06-21,03:58:57,530,1.38961E+18,hsingh013,unknown,,@CanadainIndia @CitImmCanada @nadirypatel @DKentCAN WE WANT ANSWER TO OUR QUESTIONS NOW. WHAT IS STOPPING YOU FROM RESUMING PASSPORT STAMPING SERVICES? CURFEW IN DELHI? OR COVID IN DELHI?  BOTH OF THE THINGS ARE NOW A “PAST”. BUSINESSES HAVE RESUMED. ACT WISELY🙏🏻  @vfsglobalcare,en,"[{'screen_name': 'citimmcanada', 'name': 'ircc', 'id': '91193025'}, {'screen_name': 'nadirypatel', 'name': 'nadir patel', 'id': '2530897278'}, {'screen_name': 'dkentcan', 'name': 'deirdre kent', 'id': '2214684138'}, {'screen_name': 'vfsglobalcare', 'name': '@vfsglobalcare', 'id': '1133248942701867008'}]",[],[],0,0,0,[],[],https://twitter.com/hsingh013/status/1401667453977980933,FALSE,,0,,India,,,,,,[],,,,
1.40167E+18,1.40167E+18,2021-06-07 03:54:20 India Standard Time,07-06-21,03:54:20,530,1.38103E+18,aqalsher3,𝓔𝓷𝓰𝓻 𝓐𝓠𝓐𝓛 𝓢𝓗𝓔𝓡 𝓚𝓗𝓐𝓝 🇸🇦🇵🇰,,saudi arab may kohi bahi ko covid 19 ویکسین  nahi milta hay to yi software  kay zarigy mill sakhta hay  https://t.co/WPRml7J3AW,tl,[],[],['https://pbs.twimg.com/media/E3O4D92X0AEY9hH.jpg'],0,0,0,[],[],https://twitter.com/Aqalsher3/status/1401666292793368578,FALSE,,1,https://pbs.twimg.com/media/E3O4D92X0AEY9hH.jpg,India,,,,,,[],,,,
1.40166E+18,1.40166E+18,2021-06-07 03:32:56 India Standard Time,07-06-21,03:32:56,530,627557784,bachansirohi,Bachan Sirohi,,Meerut is one of the 4 districts of UP where covid curfew continues beyond 7th Jun 21?,en,[],[],[],0,0,0,[],[],https://twitter.com/bachansirohi/status/1401660908938555393,FALSE,,0,,India,,,,,,[],,,,
1.40166E+18,1.40166E+18,2021-06-07 03:32:19 India Standard Time,07-06-21,03:32:19,530,1.15814E+18,sudipta47527945,Sudipta Mandal,,Every month more than one of my circle of people is dying due to Covid. Still vaccination process is very slow. Many frontline Corona Warriors have not yet been vaccinated. The Government needs to be further improved the vaccination policy.,en,[],[],[],0,0,0,[],[],https://twitter.com/Sudipta47527945/status/1401660751236972546,FALSE,,0,,India,,,,,,[],,,,
1.40166E+18,1.40166E+18,2021-06-07 03:15:20 India Standard Time,07-06-21,03:15:20,530,1.20519E+18,bharathadepu2,Author_BharathAdepu,,COVID-19 has been devastating so far making many kids as orphans! I hope the Authorities will look into the matter and help the innocent children! @KTRTRS @blsocialwelfare @SocialWelfareBd @PamelaSatpathy @trsharish @revanth_anumula @Collector_WGLU @ManoVikasa @SrinivasThoutam,en,"[{'screen_name': 'ktrtrs', 'name': 'ktr', 'id': '118787224'}, {'screen_name': 'blsocialwelfare', 'name': 'socialwelfareportal', 'id': '203994446'}, {'screen_name': 'socialwelfarebd', 'name': 'social welfare board', 'id': '2319216522'}, {'screen_name': 'pamelasatpathy', 'name': 'pamela satpathy', 'id': '2604918187'}, {'screen_name': 'trsharish', 'name': 'harish rao thanneeru', 'id': '192942692'}, {'screen_name': 'revanth_anumula', 'name': 'revanth reddy', 'id': '706842521796632576'}, {'screen_name': 'manovikasa', 'name': 'mallikamba mano vikasa kendram', 'id': '1241645754730438659'}, {'screen_name': 'srinivasthoutam', 'name': 'thoutam srinivas', 'id': '795188750133370880'}]",[],[],0,0,0,[],[],https://twitter.com/BharathAdepu2/status/1401656479791284224,FALSE,https://twitter.com/fasi_adeeb/status/1401429787621556233,0,,India,,,,,,[],,,,
1.40165E+18,1.40165E+18,2021-06-07 03:04:08 India Standard Time,07-06-21,03:04:08,530,338065800,moriya_ichigo,Cloud Liu ☁,,"Hi-so clubbing, Covid explosion: Krystal clear  https://t.co/w5jN0gapnW",en,[],['https://www.bangkokpost.com/thailand/general/2127711/hi-so-clubbing-covid-explosion-krystal-clear'],[],0,0,0,[],[],https://twitter.com/Moriya_Ichigo/status/1401653657305632772,FALSE,,0,,India,,,,,,[],,,,
1.40165E+18,1.40165E+18,2021-06-07 02:56:03 India Standard Time,07-06-21,02:56:03,530,3323710512,tranthudung2,Diana Tran 🕊⚖️,,Sale is small deal ! Wearing it is big deal ! Cause don't know on heaven have this beautiful handmade like this ? 🌬🌬😂🤣😹😹😹  Wearing it right now cause if tomorow I died by Covid china my soul ghost already knew how is beauty handmade 🌬😂🤣🤢😷 #madebyme  https://t.co/LvqwTiOTa6,en,[],[],"['https://pbs.twimg.com/media/E3Oqt5-UUAIEXhY.jpg', 'https://pbs.twimg.com/media/E3Oqt5-VIAE94Yu.jpg', 'https://pbs.twimg.com/media/E3Oqt5-VgAMkDrm.jpg', 'https://pbs.twimg.com/media/E3Oqt5_VkAISwQT.jpg']",0,0,1,['madebyme'],[],https://twitter.com/TranThuDung2/status/1401651624875937793,FALSE,,1,https://pbs.twimg.com/media/E3Oqt5-UUAIEXhY.jpg,India,,,,,,[],,,,
1.40165E+18,1.40165E+18,2021-06-07 02:52:27 India Standard Time,07-06-21,02:52:27,530,3323710512,tranthudung2,Diana Tran 🕊⚖️,,Eat luxury a meal ! If tomorow died by Covid china ! My soul ghost knew how is the tiger praw shrimp 😂🤣🌬🌬🌬🌬🌬🍻🍺😹😹😹😹😁 #cookbyme  https://t.co/QmcO6qwH35,en,[],[],"['https://pbs.twimg.com/media/E3Op3duVgAIhOkw.jpg', 'https://pbs.twimg.com/media/E3Op3dyUUAA_iAN.jpg', 'https://pbs.twimg.com/media/E3Op3dwVkAMIkJK.jpg', 'https://pbs.twimg.com/media/E3Op3dwVEAMjf5K.jpg']",0,0,1,['cookbyme'],[],https://twitter.com/TranThuDung2/status/1401650719749382146,FALSE,,1,https://pbs.twimg.com/media/E3Op3duVgAIhOkw.jpg,India,,,,,,[],,,,
1.40165E+18,1.40165E+18,2021-06-07 02:51:16 India Standard Time,07-06-21,02:51:16,530,2976196967,thebhunesh,Bhunesh Maheshwari,,"Free WiFi should be for Hyderabad only, not Karachi. @SindhGovt1 needs to work on Hyd's infrastructure to turn this city into Sindh's IT Hub. Covid has proved that IT is the future &amp; will help states in their economy - more jobs, more revenue,better connectivity across the prvnc.  https://t.co/GxGfBcDtI0",en,"[{'screen_name': 'sindhgovt1', 'name': 'government of sindh', 'id': '1173629402288205825'}]",[],['https://pbs.twimg.com/media/E3OpoNZXMA4NJKH.jpg'],1,0,2,[],[],https://twitter.com/thebhunesh/status/1401650420678860803,FALSE,,1,https://pbs.twimg.com/media/E3OpoNZXMA4NJKH.jpg,India,,,,,,[],,,,
1.40278E+18,1.40278E+18,2021-06-10 05:27:59 India Standard Time,10-06-21,05:27:59,530,2824270308,sohaira_hj,soha,,Hi i have covid,en,[],[],[],0,0,0,[],[],https://twitter.com/Sohaira_HJ/status/1402777021999108097,FALSE,,0,,India,,,,,,[],,,,
1.40278E+18,1.40278E+18,2021-06-10 05:22:27 India Standard Time,10-06-21,05:22:27,530,35784104,nisnm,izy nikmat,,"Oncall Covid ICU nye esok, harini dah precall blues 😞",in,[],[],[],0,0,0,[],[],https://twitter.com/nisnm/status/1402775631729893377,FALSE,,0,,India,,,,,,[],,,,
1.40278E+18,1.40266E+18,2021-06-10 05:21:44 India Standard Time,10-06-21,05:21:44,530,60583959,cryptocompass7,The Crypto Compass,,@WClementeIII @glassnode I think #bitcoin FUD has peaked out.  boomers in Singapore have started to short #bitcoin out of boredom being cooped up at home (Singapore is in covid lockdown).  This dude ran for presidency a few years ago  https://t.co/83ZWWNAdYP,en,[],[],['https://pbs.twimg.com/media/E3eo1TqUUAMYVWp.jpg'],1,0,3,"['bitcoin', 'bitcoin']",[],https://twitter.com/cryptocompass7/status/1402775449445433344,FALSE,,1,https://pbs.twimg.com/media/E3eo1TqUUAMYVWp.jpg,India,,,,,,"[{'screen_name': 'WClementeIII', 'name': 'Will Clemente', 'id': '1270906326823186432'}, {'screen_name': 'glassnode', 'name': 'glassnode', 'id': '1022821051187822593'}]",,,,
1.40277E+18,1.40277E+18,2021-06-10 05:16:27 India Standard Time,10-06-21,05:16:27,530,9.95941E+17,rozmalmalakan,Rozmal Malakan,,"Pesakit dengan kadar gula dalam darah tinggi yang tidak normal, mungkin dua kali ganda berisiko maut akibat COVID-19, kata penyelidik di China, hari ini.  ***** ""Kurangkan manis dalam minuman serta makanan, lebihkan manis dalam senyuman""   https://t.co/MABfeohbLa",in,[],['https://www.bharian.com.my/dunia/eropah/2020/07/709577/covid-19-gula-tinggi-dalam-darah-tingkatkan-risiko-kematian'],[],0,0,0,[],[],https://twitter.com/RozmalMalakan/status/1402774121159696384,FALSE,,0,,India,,,,,,[],,,,
1.40277E+18,1.40277E+18,2021-06-10 05:08:02 India Standard Time,10-06-21,05:08:02,530,132444913,skvandor,adittya gupta,,Monsoon. COVID. Double whammy in India's Maximum City right now.   #Bombay #Tarpaulin #Art #Design #Creativity #Photoshop  https://t.co/v52insWrIp,en,[],[],['https://pbs.twimg.com/media/E3elsx_VIAAMjXJ.jpg'],0,0,0,"['bombay', 'tarpaulin', 'art', 'design', 'creativity', 'photoshop']",[],https://twitter.com/skvandor/status/1402772001610031104,FALSE,,1,https://pbs.twimg.com/media/E3elsx_VIAAMjXJ.jpg,India,,,,,,[],,,,
1.40277E+18,1.40277E+18,2021-06-10 05:01:02 India Standard Time,10-06-21,05:01:02,530,8.36489E+17,sulinglincna,Lin Suling,,"Do you know what 95% vaccine efficacy means for you? Hint: No, doesn’t mean you now have a 5% chance of catching #covid compared to not being vaccinated.",en,[],[],[],1,0,1,['covid'],[],https://twitter.com/SulingLinCNA/status/1402770243445878790,FALSE,https://twitter.com/ChannelNewsAsia/status/1402756306436386820,0,,India,,,,,,[],,,,
1.40277E+18,1.40275E+18,2021-06-10 05:00:53 India Standard Time,10-06-21,05:00:53,530,352155370,nh_nh_,Nurdin Hasan,,"@CNNIndonesia Ingat covid-19 masih belum juga reda. Tingkatkan imunitas tubuh dengan meminum Qust al Hindi. InsyaAllah, telah banyak yang merasakan manfaatnya.   Pesan di WA: 0811684351  PROMO, kalau beli 3 botol, gratis ongkos kirim.  https://t.co/MtwPT43JqG",in,[],[],"['https://pbs.twimg.com/media/E3ekCg7VoAcUbKu.jpg', 'https://pbs.twimg.com/media/E3ekDGaUUAUTjre.jpg', 'https://pbs.twimg.com/media/E3ekD6NUYAIco8D.jpg']",0,0,2,[],[],https://twitter.com/nh_nh_/status/1402770203373543428,FALSE,,1,https://pbs.twimg.com/media/E3ekCg7VoAcUbKu.jpg,India,,,,,,"[{'screen_name': 'CNNIndonesia', 'name': 'CNN Indonesia', 'id': '17128975'}]",,,,
1.40277E+18,1.40277E+18,2021-06-10 04:57:37 India Standard Time,10-06-21,04:57:37,530,132444913,skvandor,adittya gupta,"{'type': 'Point', 'coordinates': [19.0604799, 72.82957551]}",NFT worthy?   #5amArt #Bombay #Monsoons #covid_19 #Tarpaulins #Design #Photoshop #artistsoninstagram @ Pali Hills Bandra West  https://t.co/Ud6mxMeeXI,en,[],['https://www.instagram.com/p/CP6vhMXjPYK/?utm_medium=twitter'],[],0,0,0,"['5amart', 'bombay', 'monsoons', 'covid_19', 'tarpaulins', 'design', 'photoshop', 'artistsoninstagram']",[],https://twitter.com/skvandor/status/1402769381080375298,FALSE,,0,,India,,,,,,[],,,,
1.40277E+18,1.40277E+18,2021-06-10 04:41:03 India Standard Time,10-06-21,04:41:03,530,2861886164,mrlamba5,mr. lamba,,@cmohry Hello CM Sir I am covid 19 patient and corona frontline worker also now I am home Quarantine so how can I boost my immunity after awakening the whole night here is daily a power cut between 10PM-5AM. You and the Govt doing a lot better in all fields plz do the needful,en,[],[],[],1,0,0,[],[],https://twitter.com/mrlamba5/status/1402765214869647363,FALSE,,0,,India,,,,,,[],,,,
1.40276E+18,1.40276E+18,2021-06-10 04:33:12 India Standard Time,10-06-21,04:33:12,530,3016073652,khazransays,Mohammad Hazran🇵🇰,,In Pakistan we are developing a Covid-19 legacy to end poverty and drive health for all. Via @Telegraph  #COVID19    https://t.co/xawgpXYTKU,en,"[{'screen_name': 'telegraph', 'name': 'the telegraph', 'id': '16343974'}]",['https://www.telegraph.co.uk/global-health/science-and-disease/pakistan-developing-covid-19-legacy-end-poverty-drive-health/'],[],0,0,0,['covid19'],[],https://twitter.com/KhazranSays/status/1402763235808403456,FALSE,,0,,India,,,,,,[],,,,
1.40276E+18,1.40276E+18,2021-06-10 04:33:06 India Standard Time,10-06-21,04:33:06,530,290889806,trendsmetadata,data about data,"{'type': 'Point', 'coordinates': [21.76788958, 78.87176058]}","50K+ #Google searches 4 Delta variant 7h old  https://t.co/mndK88w3hQ  https://t.co/hz7EoDPNwW  #India 🌅 5:30 🌆 18:57 IST #Covid #India 06/08/2021 New Cases 17DMA 145,079 Δ-34.7% New Deaths 17DMA 3,281 Δ-12.3%  https://t.co/wNakHc5iyT",ca,[],"['http://www.google.com/m/search?&q=Delta+variant', 'https://twitter.com/search/?q=Delta+variant']","['https://pbs.twimg.com/media/E3edsdeWUAgbyYM.png', 'https://pbs.twimg.com/media/E3edtNjXEAAcANA.jpg']",0,0,0,"['google', 'india', 'covid', 'india']",[],https://twitter.com/trendsmetadata/status/1402763211703787523,FALSE,,1,https://pbs.twimg.com/media/E3edsdeWUAgbyYM.png,India,,,,,,[],,,,
1.40276E+18,1.40276E+18,2021-06-10 04:15:25 India Standard Time,10-06-21,04:15:25,530,1483568786,cipher_rr,____M U S A M U🌴,,No covid their? I can see no face mark🤔🤭,en,[],[],[],0,0,0,[],[],https://twitter.com/CIPHER_RR/status/1402758760557420544,FALSE,https://twitter.com/dawisu/status/1401846996948996097,0,,India,,,,,,[],,,,
1.40275E+18,1.40275E+18,2021-06-10 03:22:02 India Standard Time,10-06-21,03:22:02,530,8.3655E+17,sipgrab,SipGrab,"{'type': 'Point', 'coordinates': [12.93354386, 77.63237648]}",Valneva completes Phase 3 trial recruitment for its inactivated COVID-19 vaccine candidate  https://t.co/sTXSy3QHru #Nifty #sipgrab,en,[],['http://dlvr.it/S1Pyfy'],[],0,0,0,"['nifty', 'sipgrab']",[],https://twitter.com/sipgrab/status/1402745329515044864,FALSE,,0,,India,,,,,,[],,,,
1.40274E+18,1.40274E+18,2021-06-10 03:10:53 India Standard Time,10-06-21,03:10:53,530,1.32151E+18,munadas85679377,muna dash,,"@Naveen_Odisha Dear sir I am laxmi narayan dash from jeypore koraput, due to the current pandemic of covid I lost my job  . Request to you sir kindly help my elder daughter to admission govt school std 6th.She was in private school they wants due 2 month fees for tc.",en,[],[],[],0,0,0,[],[],https://twitter.com/munadas85679377/status/1402742520832925699,FALSE,,0,,India,,,,,,[],,,,
1.40274E+18,1.40232E+18,2021-06-10 03:02:29 India Standard Time,10-06-21,03:02:29,530,1.32151E+18,munadas85679377,muna dash,,"@PMOIndia @narendramodi Dear Sir my name is laxmi narayan dash from jeypore ,koraput,odisha Sir due to the pandemic of covid I lost my job ,we are 5 numbers of family members including 2 kids ,I leaving in a rental house . Due to financial problem I unable to give admission for my elder daughter.",en,[],[],[],0,0,0,[],[],https://twitter.com/munadas85679377/status/1402740409537753088,FALSE,,0,,India,,,,,,"[{'screen_name': 'PMOIndia', 'name': 'PMO India', 'id': '471741741'}, {'screen_name': 'narendramodi', 'name': 'Narendra Modi', 'id': '18839785'}]",,,,
